Fawn,05-03-LF,2,17/07/2019,B,LR,F,F,IGDB,Catherine,2018-03-16,2019-05-01,2019-11-25,208 days,GD,2.0,Success,,,1.0,5.0,1.0,,,1.0,,,3,4,3,1,dog mostly walks ahead of handler,,3,dog moved as saw treats,,4.0,,,4,3.0,,,,4.0,3,No,No,,,,No,Yes,Yes,Yes,Yes,Yes,No,Yes,Yes,Yes,Yes,Yes,,played a lot with the tea towel,,6,5,6,6,6,5.0,6.0,6.0,4,5.0,6,,very distracted in general,,4,"dog sits, looks briefly away twice",,None,3.0,2.0,1.0,,2.0,,,5,,,"dog distraction didn't have a collar on, ended up off lead and in with the dog being tested. No recall done.",,1.0,2.0,3.0,3.0,1.0,1.0,1.0,3.0,1.0,2.0,2.0,No,,,,1.0,1.0,4.0,,4.0,"dog came out and moved away from handler initially, but then returned and enjoyed being petted",,4.0,2.0,2.0,2.0,1.0,No,,,4.0,handler didn't interact much iniatially,,,6.0,,bucket ignored 2nd time,,,,,,,,,,,
Eldin,05-05-LE,1,29/05/2019,B,LRx,M,E,IGDB,Rose,2018-03-12,2019-05-01,2019-12-13,226 days,GD,2.0,Success,,,2.0,4.0,1.0,,,,dog had naturally come back to the handler,,2,2,2,3,,,4,,,4.0,,,4,3.0,,,,4.0,2,Yes,No,,anxious panting during vet exam,,No,Yes,Yes,Yes,Yes,Yes,No,Yes,Yes,No,Yes,Yes,,"doesn't move 2nd time, just turns around and removes it with his mouth",,6,5,5,1,5,4.0,4.0,5.0,3,4.0,7,,"didn't go near the food bowl the first time, went around 3 times",,4,"dog sat initially but then walk away, unsure if dog was aware of the stuffed kong, shown again and dog sat and waited for it.",,Both,3.0,2.0,2.0,,2.0,"dog sat for a short while and then walked away from the handler, dog may not have realised the handler had a stuffed kong, called dog back and showed him the kong.",,3,0.0,,dog moved after dog distraction dog had gone in,,1.0,2.0,2.0,1.0,1.0,1.0,1.0,1.0,1.0,2.0,2.0,No,,just stood there,,1.0,1.0,3.0,,4.0,gets tea towel off the chair and brings to handler,,4.0,2.0,2.0,1.0,1.0,No,,jumped up on the wall ,3.0,,,,5.0,,wanted to go toward the bucket,,,,,,,,,,,
Eldin,05-05-LE,2,17/07/2019,B,LRx,M,E,IGDB,Rose,2018-03-12,2019-05-01,2019-12-13,226 days,GD,2.0,Success,,,4.0,3.0,2.0,"urinated soon after going in, may be due to stress or not going before he came down.",,,dog was following handler around as handler had clean up after dog had urinated,,2,4,2,1,occasionally dog walked beside handler but mainly ahead,,4,panting,,3.0,,,4,3.0,,,,4.0,3,No,No,,,,No,Yes,Yes,No,Yes,Yes,No,Yes,Yes,No,Yes,Yes,,,,2,4,3,4,2,3.0,3.0,3.0,3,3.0,5,,"2nd time, handler used more voice ",,4,got up once from the sit to move closer to the handler,,Both,3.0,2.0,2.0,,2.0,"hard to see, relying on what is being said",,3,0.0,,,,1.0,2.0,3.0,1.0,1.0,1.0,1.0,1.0,1.0,2.0,2.0,No,,,,1.0,1.0,3.0,,3.0,,,4.0,2.0,2.0,1.0,1.0,No,,,3.0,,,,4.0,,walked over and looked in the bucket,,,,,,,,,,,
Zodiac,04-04-LZ,1,20/05/2019,B,LR,M,Z,Private breeder,Rose,2018-04-06,2019-04-24,2019-10-25,184 days,GD,2.0,Success,,,1.0,5.0,1.0,calmly explored ,,1.0,,,2,3,2,2,,,4,,,4.0,,,4,2.0,,"handler stayed crouched down beside dog, dog tail would wag every so often.",,3.0,3,No,No,,,,No,Yes,Yes,Yes,No,No,No,Yes,Yes,Yes,No,No,,,,4,4,4,4,3,4.0,3.0,4.0,3,3.0,5,,,,4,sits ,,,2.0,1.0,1.0,,2.0,can't see if dog uses paws due to grooming table,,7,1.0,,,,1.0,3.0,2.0,1.0,1.0,1.0,1.0,,1.0,1.0,2.0,No,,"could hear dog whining, hard to tell which dog",,1.0,1.0,3.0,,3.0,,,5.0,1.0,1.0,1.0,1.0,No,,,3.0,,,,4.0,,looks at it.,,,,,,,,,,,
Ebbi,05-14-LE,1,13/06/2019,A,LRx,F,E,IGDB,Graham,2018-03-12,2019-05-15,2019-10-25,163 days,AD,1.0,Success,,,2.0,5.0,2.0,Does come back to handler every now and then but more co-incidentally. Came back to handler purposely at very end. High scenting. Occasional body shakes - portraying body sensitivity. Panting. Would say Ebbi is stressed/anxious,,1.0,,,3,4,4,5,"At times Ebbi walks alongside her handler however, for the most part, she is highly excited and pulling to the extent of tension that causes her to pant and wheeze. Loads of body shaking exhibited with the walk - more than the original familiarisation phase. Defecated on her walk (perhaps a full bowel would explain the stress levels and pulling). Pulling less severe and panting toned down - no more wheezing - after defecation. ",,3,Didnt use platform. Started very well - got bored mid-way and waiting for more handler input,,1.0,Took many attempts (even with a lure) to complete a sit. Broke sit once too (boredom and looking for handler input/further instruction) - would say she might be quite food distracted. ,,1,1.0,,"Would only go down down for a food lure. Then broke down and handler struggled to get her to go back. Broke it a second time, and then maintained the third down. Handler had to be sitting on floor in order to achieve. ",,3.0,4,No,No,,Bit of continued panting - nothing serious. But tail wagging through most of it. ,,No,Yes,Yes,No,No,No,No,Yes,Yes,No,Yes,No,,First attempt - does walk around handler but wouldnt say this would be an attempt to get it off - more seeking handler input. ,,2,3,3,2,2,3.0,2.0,2.0,2,2.0,6,,,,2,Attention on the kong at times but at other times she is looking around the room. Not overly interested and never broke her sit,,Left,3.0,1.0,1.0,,2.0,,,4,0.0,,,,1.0,2.0,2.0,1.0,1.0,1.0,1.0,1.0,1.0,1.0,2.0,No,,Spent most of the time standing and looking back between assessor and handler. Not settled but not terribly stressed,,1.0,1.0,4.0,,3.0,,,5.0,1.0,1.0,1.0,1.0,No,,jumped up against gate once. ,3.0,,,,4.0,,"slight change in head positioning, investigated very briefly thereafter. Quick recovery",,,,,,,,,,,
Ebbi,05-14-LE,2,31/07/2019,A,LRx,F,E,IGDB,Graham,2018-03-12,2019-05-15,2019-10-25,163 days,AD,1.0,Success,,,4.0,5.0,1.0,High scenting. Does sniff around in exploration but keeps regularly and reasonably orientated to handler - doesn't veer too far off. ,,1.0,,,1,1,1,2,A little bit of shaking. Handler doesnt create too wide a walking path - keeps a relatively small circle. I think perhaps if the circle was widened the dog might be slightly more distracted. ,,4,Handler touched hind-quarters resulting in a slight break of stand but I havent counted this ,,1.0,handler asks many times without success. Dog reverses off the platform and a few times after when the handler tries to get a sit. Once sitting Ebbi maintains.  ,,1,1.0,,"Very hesitant to assume down position, eventually goes down but breaks shortly after and then refuses to go down again thereafter. Either stubbornness or body sensitivity - handler mentions that she regularly struggles but that she is also quite body sensitive. Assessor suggests that they move on but handler decides to rather keep trying even attempting a new position. Ends with refusal. ",,1.0,3,No,No,,Dog vocalisation heard from the crated dog. ,,No,Yes,Yes,No,Yes,No,No,Yes,Yes,No,Yes,No,,Heavy dog vocalisation from the crated dog,,2,3,3,2,1,2.0,1.0,2.0,2,2.0,6,,,,2,Looks away every now and then but mostly has focused attention. Good behaviour though and no jumping up or broken sit once she is asked to sit. ,,Righ,3.0,1.0,1.0,,2.0,,,5,0.0,,"While Ebbi wasnt called and she followed willingly, handler walked up to Ebbi to gain attention and then Ebbi began following",,1.0,2.0,3.0,1.0,1.0,1.0,1.0,1.0,1.0,1.0,1.0,No,,Crated dog vocalisation. Did sit on her own at the end there. Although mostly sniffing / standing - did seem calm. ,,1.0,1.0,4.0,,3.0,,,5.0,1.0,1.0,1.0,1.0,No,,Was sniffing the corner a bit but more time orientated and perhaps displacement than exploration. ,1.0,,,,3.0,,,,,,,,,,,,,
Herbie,07-02-LH,1,29/07/2019,A,LRxGR,M,H,IGDB,Graham,2018-05-11,2019-07-02,2020-03-10,252 days,GD,2.0,Success,,,5.0,1.0,5.0,Whining just about constantly - even with handler right next to him. ,,,Dog right next to handler. Handler just pops on lead - doesnt call,,3,4,3,2,"Speed and tension varies alot. From falling behind to pulling ahead ,walking infront pulling to the side (distraction based). I have selected the second option as this was the more regular S&T but this was not indicative of it being regular by any means. ",,3,Posture slightly low in fore-quarters. Rotated position toward the end,,2.0,I dont think Herbie heard the first request. Broke and rotated during latter part of the exercise. Vocalisation heard but I tihnk it is the crated dog.,,1,1.0,,"A little overly activated by the test. Kept breaking commands, and rotating, with handler at times having to re-approach completely. When he did maintain the down for a while, he was sniffing and not settled. ",,4.0,1,No,No,,Handler remarks on body sensitivity. Vocalises (whining). Handler remarks on half a growl. When handler checked front paws Herbie back away and tried to jump off the table backward then sat down when he was stopped from jumping off. Handler and assessor agree not to continue the body check. ,,No,Yes,Yes,No,No,No,Yes,No,No,No,No,No,,,,1,3,2,6,5,2.0,1.0,6.0,3,4.0,6,,No car remote so car is stationary throughout the test. I tested on the stationary car. ,,5,Quite consistently lifting hind-quarters and jumps up against handler at the end,,Both,3.0,1.0,1.0,,2.0,,,3,0.0,,,,1.0,1.0,4.0,3.0,1.0,1.0,1.0,3.0,2.0,3.0,3.0,No,,,,1.0,2.0,3.0,,3.0,,,3.0,4.0,1.0,2.0,1.0,No,,,3.0,,,,3.0,,More distracted by the assessor I would say,,,,,,,,,,,
Herbie,07-02-LH,2,17/09/2019,A,LRxGR,M,H,IGDB,Graham,2018-05-11,2019-07-02,2020-03-10,252 days,GD,2.0,Success,,,4.0,2.0,1.0,Barking and whining - but I dont know if that is from the crated dog or from Herbie. Camera has a slight blind spot next to the gate and part of the examination table .,,1.0,,,2,2,2,2,,,4,,,2.0,Needed a lure. Once seated did maintain well until the end when he broke and then handler struggled to get the sit again. ,,1,1.0,,,,4.0,1,No,No,,Immediate back up as soon as handler began checking ears and mouth. When handler checked paws he reversed off the table. They attempted again and he tried to jump off again. Assessor moves on. ,,No,Yes,Yes,No,No,No,Yes,No,No,No,No,No,,,,2,3,3,4,1,2.0,3.0,5.0,3,3.0,6,,,,5,Lifts hindquarters twice and jumps up at handler once,,Both,3.0,3.0,1.0,,2.0,,,4,0.0,,Walked very calmly toward dog. Not a high interest at all.,,1.0,4.0,1.0,1.0,1.0,1.0,1.0,1.0,1.0,1.0,2.0,No,,Sits almost immediately. Interest in the sounds coming from the dog in the crate (chewing sounds). Panting and swapping attention from handler to crated dog. ,,1.0,1.0,3.0,,2.0,,,5.0,1.0,2.0,1.0,1.0,No,,,3.0,,,,3.0,,,,,,,,,,,,,
Evie,07-03-LE,1,29/07/2019,A,LRx,F,E,IGDB,Rose,2018-03-12,2019-07-02,2020-02-02,215 days,GD,2.0,Success,,,3.0,5.0,1.0,,,2.0,,,1,1,1,2,,,3,,,1.0,,,3,1.0,,Handler stays on haunches next to dog. Loads of scenting which led to a break at the end. Assessor decided to move on to body check,,4.0,3,No,No,,Tail lower - change in neutrality. But stood still for the exam. ,,No,Yes,Yes,No,No,No,No,Yes,Yes,No,No,No,,"Both responses were the same. An initial turn of the head, tail low and slow, and then no further attempts to look at or pull the towel off. ",,3,3,2,4,1,2.0,1.0,2.0,2,2.0,5,,Car not working on first response. Scored on stationary car. Car only reverse on second response. Faulty?,,4,"Lifts hindquarters a handful of times, but modulates nicely and does not jump up. ",,Righ,3.0,3.0,1.0,,2.0,Only used right paw toward the very end. Otherwise mostly just pushed the kong around on the floor with nose and then carried to the mat. ,,5,1.0,,Moves toward dog immediately (as soon as she notices it) but not overly interested.,,1.0,1.0,4.0,1.0,1.0,1.0,1.0,1.0,1.0,1.0,2.0,No,,,,1.0,1.0,3.0,,3.0,,,5.0,1.0,1.0,2.0,2.0,No,,,3.0,,,,3.0,,,,,,,,,,,,,
Eliza,05-22-LE,1,18/06/2019,B,LRx,F,E,IGDB,Catherine,2018-03-12,2019-05-28,2019-11-12,168 days,W,0.0,Fail,,,5.0,1.0,1.0,,,,dog went into a down naturally beside the handler ,,1,1,1,3,,,2,started on the platform and went to doing it on the ground,,3.0,,,4,4.0,,settled,,4.0,3,No,Yes,,,,No,Yes,Yes,Yes,No,No,No,Yes,Yes,No,No,No,,,,2,4,3,1,3,4.0,3.0,5.0,3,2.0,5,,,,4,"dog sits and then goes into a down, keeps looking at handler calmly",,Righ,3.0,1.0,2.0,,2.0,handler moves  with dog for camera but it is too near the table ,,3,0.0,,,,1.0,4.0,3.0,1.0,1.0,1.0,1.0,1.0,1.0,1.0,1.0,No,,,,1.0,1.0,3.0,,3.0,,,5.0,1.0,1.0,1.0,1.0,No,,,3.0,,,,4.0,,,,,,,,,,,,,
Eliza,05-22-LE,2,12/08/2019,B,LRx,F,E,IGDB,Catherine,2018-03-12,2019-05-28,2019-11-12,168 days,W,0.0,Fail,,,2.0,4.0,2.0,handle moves around toward slightly,,1.0,,,1,1,1,2,,,4,,,2.0,,,4,3.0,,,,4.0,3,No,No,,Looks like dog doesn't licks or mouths as handle was in between camera and dog ,,No,Yes,Yes,Yes,Yes,No,No,Yes,Yes,Yes,No,No,,,,1,4,4,3,4,3.0,3.0,3.0,2,2.0,5,,,,2,"used ragger, no kong, dog sits and goes into a down eventually",,,,1.0,,,,ragger used instead of kong,,3,0.0,,,,1.0,3.0,4.0,1.0,2.0,1.0,1.0,1.0,1.0,1.0,1.0,No,,,,1.0,1.0,2.0,,2.0,handler mentions only has dog three days,,3.0,3.0,1.0,1.0,1.0,No,,,3.0,,,,4.0,,bucket was placed on the ground,,,,,,,,,,,
Edrick,05-11-LE,1,13/06/2019,B,LRx,M,E,IGDB,Rose,2018-03-12,2019-05-15,2020-07-09,421 days,GD,2.0,Success,,,2.0,4.0,2.0,,,1.0,,,1,2,2,2,,,2,,,4.0,went from a stand into a sit without being asked,,4,3.0,,,,4.0,3,No,No,,,,No,Yes,Yes,Yes,Yes,No,No,Yes,Yes,Yes,Yes,Yes,,,,4,5,4,6,3,5.0,3.0,5.0,4,5.0,7,,,,4,"sat, then went into a down",,Righ,3.0,1.0,2.0,,2.0,he definitely used his right but dog was lying with his back towards camera,,4,2.0,,,,1.0,3.0,3.0,3.0,1.0,1.0,2.0,3.0,1.0,2.0,2.0,No,,,,,,,,,handler didn't interact with dog,,5.0,1.0,1.0,3.0,1.0,No,,,4.0,"handler commented that they had forgotten to do the petting after the crate, they stayed longer interacting but I didn't score as it didn't happen after the crate.",,,4.0,,,,,,,,,,,,,
Edrick,05-11-LE,2,31/07/2019,B,LRx,M,E,IGDB,Rose,2018-03-12,2019-05-15,2020-07-09,421 days,GD,2.0,Success,,,2.0,4.0,2.0,,,1.0,,,2,2,2,2,,,2,started on platform and then did on the ground,,4.0,,,4,4.0,,,,4.0,3,No,No,,,,No,Yes,Yes,Yes,Yes,No,No,Yes,Yes,Yes,Yes,Yes,,,,3,4,3,5,3,4.0,3.0,5.0,3,5.0,5,,,,2,sits and then lies down ,,Righ,3.0,1.0,2.0,,2.0,dog was on lead but didn't get up to try and move away.,,3,,,no call back done as handler walked towards the crate.,,1.0,2.0,3.0,3.0,3.0,1.0,1.0,3.0,2.0,3.0,2.0,No,,,,1.0,1.0,3.0,,2.0,,,5.0,1.0,1.0,2.0,4.0,No,,,4.0,,,,4.0,,,,,,,,,,,,,
Evie,07-03-LE,2,17/09/2019,A,LRx,F,E,IGDB,Rose,2018-03-12,2019-07-02,2020-02-02,215 days,GD,2.0,Success,,,5.0,2.0,2.0,Vocalisation - inaudible - think it might be the crated dog. Evie remained at handlers side the entire time. she sniffed for a little which can be seen as exploration but still remained by the handlers side. ,,,Was directly behind handler and no need to be called back,,1,1,1,2,Every now and then looks like she falls back but I think this is more to give room for handler to turn corners.,,4,A little bit of sniffing but maintained. ,,2.0,Think she is overaware of the platform but this platform is very small so I never counted these broken attempts. When off she went into a down rather than a sit as requested. When asked to upsit she struggled. Then asked to sit and broke a few times. (Body sensitivity?) ,,4,4.0,,Lay down rather than sitting - assessor and handler used this to test her down rather than her sit. Maintained.,,1.0,3,No,No,,,,Yes,No,No,No,No,No,Yes,No,No,No,No,No,,,,2,2,2,2,2,2.0,2.0,2.0,1,1.0,4,,,,2,A very small lift in hindquarters here and there - think this is more due to body sensitivity. Well behaved even though she is definitely interested. ,,Both,3.0,1.0,1.0,,2.0,,,5,1.0,,,,1.0,4.0,4.0,1.0,1.0,1.0,1.0,1.0,1.0,1.0,1.0,No,,While she was standing for all of it she did seem settled - no signs of stress like panting etc. ,,1.0,1.0,3.0,,1.0,,,5.0,1.0,1.0,1.0,1.0,No,,,3.0,,,,4.0,,A very minor suss - nothing more. Extremely quick recovery ,,,,,,,,,,,
Zac,07-04-LZ,1,29/07/2019,A,LR,M,Z,Private breeder,Rose,2018-04-06,2019-07-02,2019-10-25,115 days,W,0.0,Fail,,,1.0,5.0,1.0,Vocalisation - think it might be from crated dog. ,,3.0,Started to come back but then got distracted and didnt want to come back,,2,1,1,3,,,4,Seemed to be obsessively looking for treats in handlers hands. Tail wagging and very activated but maintained. ,,3.0,Sit first exhibited. Quite restless and needed alot of handler support but maintained for the most part. ,,1,1.0,,Sniffing and distracted. Got off the platform and handler struggled to regain attention. Need constant support and intervention with many breaks inbetween ,,4.0,4,No,No,,was panting but seemed happy otherwise overall.,,No,Yes,Yes,No,No,No,No,Yes,Yes,No,No,No,,Very avoidant regarding having towel draped over him on both occasions,,6,3,4,3,3,2.0,2.0,5.0,3,4.0,6,,Car wasnt working - based scores on stationary car. ,,5,Very boisterous and misbehaved jumping up at handler regularly. ,,Righ,4.0,1.0,5.0,,3.0,,,2,1.0,,more interested in environment and still looking for food in handlers hands ,,1.0,1.0,4.0,1.0,1.0,1.0,1.0,,1.0,2.0,2.0,No,,Vocalisation I think from crated dog rather than Zac but not certain,,1.0,2.0,1.0,,3.0,Avoids but out of playfulness and because he is so into the environment - not fear avoidance. When handler holds collar his tail is wagging and he is happy enough,,4.0,3.0,1.0,2.0,1.0,No,,,3.0,,,,4.0,,Very slight suss with an extremely quick recovery. Did want to investigate ,,,,,,,,,,,
Zac,07-04-LZ,2,18/09/2019,A,LR,M,Z,Private breeder,Rose,2018-04-06,2019-07-02,2019-10-25,115 days,W,0.0,Fail,,,2.0,5.0,1.0,Startle when seeing the bucket. High interest in something by the gate,,1.0,Did turn back to go back to handler even though handler met him kind of half way,,3,2,1,2,,,2,Highly scent distracted and for this reason the platform wasnt used. Very activated and shaking body (displacement / body sensitivity) also still quite distracted by environment and scent and needing alot of handler support,,3.0,Was asked to sit but lay down - down response tested first. Good handler intervention as I think he would have broken sit a lot more without it. ,,3,1.0,,Was asked to sit but lay down so down response tested before sit.  Very unsettled and sniffing alot as well as breaking twice.  ,,4.0,3,No,Yes,,,,No,Yes,Yes,Yes,Yes,No,No,Yes,Yes,No,Yes,No,,On second attempt tried to avoid towel being put on his back,,5,3,6,3,5,3.0,6.0,5.0,4,5.0,6,,,,5,Highly activated and jumping up constantly at handler. ,,Both,4.0,1.0,1.0,,2.0,As the kong was no longer frozen he learnt that if he lifted and tilted it treats would fall out and so he only interacted to do this and when the treats were no longer falling out with ease. ,,6,1.0,,,,1.0,1.0,4.0,1.0,3.0,1.0,1.0,1.0,1.0,3.0,3.0,No,,,,1.0,1.0,4.0,,3.0,,,4.0,2.0,4.0,1.0,1.0,No,,,3.0,,,,4.0,,Did run to investigate but not stressed I wouldnt say more inquisitive (even after initial startle at the bucket from the beginning),,,,,,,,,,,
Goober,07-01-LG,1,29/07/2019,B,LRxGR,M,G,IGDB,Graham,2018-04-15,2019-07-02,2020-02-03,216 days,GD,2.0,Success,,,1.0,5.0,1.0,,,2.0,,,1,2,2,3,,,3,,,4.0,,,1,1.0,,handler used treats ,,4.0,3,No,No,,,,No,Yes,Yes,Yes,Yes,No,No,Yes,Yes,Yes,Yes,Yes,,,,5,5,4,5,5,4.0,4.0,5.0,4,5.0,5,,,,5,"broke sit, whined, nudged handler, ",,Left,3.0,1.0,2.0,,2.0,handler stepped away from dog but dog didn't move from the spot. dog gave one bark while he had the kong,,4,1.0,,,,1.0,2.0,2.0,4.0,1.0,1.0,1.0,4.0,1.0,3.0,3.0,No,,,,2.0,1.0,3.0,,2.0,,,3.0,3.0,2.0,3.0,1.0,No,,,3.0,,,,4.0,,,,,,,,,,,,,
Goober,07-01-LG,2,17/09/2019,B,LRxGR,M,G,IGDB,Graham,2018-04-15,2019-07-02,2020-02-03,216 days,GD,2.0,Success,,,1.0,5.0,1.0,,,2.0,handler just used dog's name,,2,2,2,3,,,4,,,1.0,,,1,1.0,,"dog wouldn't stay down, dog very slow to sit. dog very stressed",,4.0,3,No,No,,,,No,Yes,Yes,Yes,Yes,Yes,No,Yes,Yes,Yes,Yes,Yes,,,,3,4,3,4,1,4.0,4.0,3.0,3,4.0,5,,,,4,dog broke sit and  moved towards the handler,,Both,3.0,1.0,3.0,,2.0,,,6,3.0,,"dog wouldn't come back initially, picked up sticker for a chase and eventually came back for a treat.",,3.0,2.0,2.0,4.0,1.0,1.0,1.0,3.0,1.0,3.0,2.0,No,,,,1.0,1.0,2.0,,2.0,,,4.0,2.0,2.0,2.0,1.0,No,,dog was looking for dog nuts that were dropped earlier by accessor,3.0,,,,4.0,,,,,,,,,,,,,
Gav,07-12-LG,1,21/08/2019,A,LRxGR,M,G,IGDB,Rose,2018-04-15,2019-06-16,2020-01-28,226 days,AD,1.0,Success,,,2.0,5.0,1.0,,,1.0,,,3,2,2,2,"Very rare pull for distractions only, and even then very mild. The walking initiative changed a lot - ranging from walking behind to walking beside and ahead. However, he walked at handlers side more than anything else",,3,Quite distracted - looking for treats in handlers hands and sniffing the platform. Slightly activated. Maintained for the most part. There was a break at the end - handler and assessor decide to continue with a sit from then on ,,1.0,"Broke sit and walked off the platform, then when asked to sit again he lay down. Lay down, handler continued once that own was broken. Broke a couple times again. ",,1,1.0,, ,,4.0,2,No,No,,Started off being more co-operative. But broke half way through and looked like he wanted to jump off but he still allowed the body check to continue with handler support. ,,No,Yes,Yes,No,Yes,No,Yes,No,No,No,No,No,,,,3,2,4,1,3,2.0,4.0,6.0,2,5.0,4,,,,5,Unsettled and jumping up at handler after sitting for a short while ,,Both,3.0,3.0,5.0,,4.0,,,5,0.0,,,,1.0,1.0,4.0,3.0,1.0,1.0,1.0,3.0,1.0,2.0,2.0,No,,,,1.0,2.0,3.0,,2.0,Initially interacts calmly with a wagging tail but quickly loses interest and begins exploring (does return),,5.0,1.0,1.0,2.0,4.0,No,,,3.0,,,,6.0,,Immediately ran toward the bucket but not fearful - more inquisitive and excited activation,,,,,,,,,,,
Gav,07-12-LG,2,14/10/2019,A,LRxGR,M,G,IGDB,Rose,2018-04-15,2019-06-16,2020-01-28,226 days,AD,1.0,Success,,,2.0,5.0,2.0,,,1.0,,,1,1,1,2,,,3,,,3.0,,,1,1.0,,Handler remarks on body sensitivity. Breaks consistently even with constant handler support,,4.0,4,No,No,,,,No,Yes,No,Yes,No,No,No,Yes,Yes,Yes,Yes,No,,,,2,3,3,1,2,2.0,2.0,4.0,2,3.0,6,,,,4,Lifted hind quarters briefly and then composed himself. Did jump up once on the initial seeing the kong but modulated quickly ,,Both,3.0,3.0,4.0,,2.0,Initially picked up the kong and walked around for a while to find a place to settle with it - definitely would have entered crate if open. After moving around for a while with the kong in his mouth he settles by his handlers feet.,,4,0.0,,,,1.0,4.0,2.0,1.0,1.0,2.0,1.0,1.0,1.0,1.0,1.0,No,,Doesnt lay down but sat very calmly - good self modulation. ,,1.0,1.0,3.0,,3.0,While happy and keeps close to handler - not overly interested in play at all,,4.0,3.0,1.0,1.0,1.0,No,,,3.0,,,,3.0,,,,,,,,,,,,,
Effie,07-13-LE,1,21/08/2019,B,LRx,F,E,IGDB,Graham,2018-03-12,2019-07-30,2020-02-03,188 days,GD,2.0,Success,,,2.0,4.0,2.0,,,1.0,,,2,2,1,2,camera too far over and dog goes out of view a few times,,2,,,4.0,,,1,1.0,,,,4.0,4,No,No,,,,No,Yes,Yes,Yes,Yes,No,No,Yes,Yes,Yes,Yes,Yes,,used towel instead of tea towel,,1,4,3,4,1,3.0,3.0,3.0,3,3.0,5,,can't see the dog's food reaction but you can make a judgement by seeing the handler which was due to the camera angle,,2,sits calmly,,Left,3.0,1.0,1.0,,2.0,handler steps away from kong/dog but dog doesn't move from the spot,,3,0.0,,handler moved toward assessor to give treats to assessor for dog distraction dog ,,1.0,2.0,2.0,4.0,1.0,1.0,1.0,2.0,4.0,3.0,3.0,No,,,,1.0,1.0,3.0,,3.0,,,4.0,2.0,3.0,2.0,4.0,No,,,4.0,,,,5.0,,,,,,,,,,,,,
Effie,07-13-LE,2,10/10/2019,B,LRx,F,E,IGDB,Graham,2018-03-12,2019-07-30,2020-02-03,188 days,GD,2.0,Success,,,4.0,2.0,3.0,,,1.0,dog was near handler,,1,3,2,2,,,4,,,4.0,,,1,1.0,,,,4.0,4,No,No,,,,No,Yes,Yes,Yes,Yes,No,Yes,No,Yes,No,No,No,,,,2,3,3,4,2,3.0,3.0,3.0,2,2.0,4,,,,2,"sit, then goes into a down",,Righ,3.0,2.0,1.0,,2.0,,,3,0.0,,handler sat in chair with dog off lead on his left.,,1.0,4.0,2.0,1.0,1.0,1.0,1.0,1.0,1.0,1.0,1.0,No,,,,3.0,1.0,5.0,,3.0,,,5.0,1.0,1.0,1.0,1.0,No,,,4.0,,,,4.0,,,,,,,,,,,,,
Harvey,08-02-LH,1,18/09/2019,A,LRxGR,M,H,IGDB,Rose,2018-05-11,2019-08-21,2020-01-28,160 days,AD,1.0,Success,,,2.0,5.0,1.0,,,1.0,,,2,1,1,2,Does fall back but more around corners - more consistently a walk at heel,,4,Slightly scent distracted. Platform not used. Maintained,,2.0,At the end he goes into a down without being requested to do so. Assessor and handler move on at this point. ,,4,3.0,,"Not asked to lie down, but maintains down well thereafter. ",,2.0,3,No,No,,Very hesitant jump up. Handler uses food lure and hoists rear end to assist him up.,,No,Yes,Yes,No,No,No,Yes,No,No,No,No,No,,Second attempt the tea towel was placed higher up - he was not phased at all with the second attempt. ,,2,2,2,4,2,2.0,2.0,4.0,2,2.0,4,,,,4,Does stand from seated position half way through concentration but no inappropriate behaviour - very excited.,,Righ,4.0,1.0,1.0,,2.0,,,5,2.0,,Doesnt notice dog at first but as soon as he does he goes toward it immediately.,,1.0,1.0,3.0,1.0,1.0,2.0,1.0,3.0,1.0,2.0,3.0,No,,Wasnt sure if whining was associated with this dog or with the crated dog (for dog distraction) but the whining stopped as soon as he was out and only happened during this session ,,1.0,1.0,3.0,,3.0,,,3.0,4.0,1.0,,1.0,No,,Not sure where the whining is coming from. ,3.0,,,,4.0,,Slight head tilt and showed a little concern but recovered very quickly,,,,,,,,,,,
Harvey,08-02-LH,2,30/10/2019,A,LRxGR,M,H,IGDB,Rose,2018-05-11,2019-08-21,2020-01-28,160 days,AD,1.0,Success,,,4.0,5.0,1.0,Mostly stayed close to the handler - even while exploring. ,,1.0,,,1,1,1,2,,,3,No platform used. ,,4.0,,,4,3.0,,First attempt I think he was confused - didnt count it as a broken attempt. Slight interest in the environment,,1.0,3,No,No,,slight tail tuck,,No,Yes,Yes,No,No,No,No,Yes,Yes,No,No,No,,Low tail carriage,,3,2,2,3,2,2.0,2.0,3.0,2,2.0,4,,Very mild pull strength,,4,Breaks sit and intense staring. No inappropriate behaviour shown. Good modulation,,Left,3.0,2.0,1.0,,2.0,Picks up kong and walks a circle or two around handler but then settles at handlers feet. ,,5,1.0,,Loses interest quickly,,1.0,4.0,1.0,1.0,1.0,1.0,1.0,1.0,1.0,1.0,1.0,No,,,,1.0,1.0,4.0,,3.0,,,4.0,2.0,1.0,1.0,1.0,No,,,3.0,,,,3.0,,More inquisitive at the sight of the bucket than the noise - head slight perked up at the assessor holding the bucket before it was dropped,,,,,,,,,,,
