Gretel,07-14-LG,1,21/08/2019,B,LRxGR,F,G,IGDB,Catherine,2018-04-15,2019-07-21,2019-11-29,131 days,AD,1.0,Success,,,1.0,5.0,1.0,,,1.0,,,2,3,2,2,,,4,,,3.0,,,3,3.0,,,,1.0,3,No,No,,,,No,No,No,No,No,No,Yes,Yes,Yes,Yes,Yes,No,,tea towel on top of body strap for the 1st one and on lower back for the 2nd.   ,,5,4,4,5,4,4.0,4.0,5.0,4,5.0,5,,,,5,dog jumps up at handler once,,None,3.0,3.0,2.0,,2.0,,,4,1.0,,handler walked towards the crate and called the dog,,1.0,2.0,3.0,4.0,3.0,1.0,3.0,3.0,4.0,3.0,3.0,No,,,,1.0,1.0,1.0,,2.0,,,4.0,3.0,3.0,2.0,1.0,No,,,3.0,,,,4.0,,,,,,,,,,,,,
Gretel,07-14-LG,2,10/10/2019,B,LRxGR,F,G,IGDB,Catherine,2018-04-15,2019-07-21,2019-11-29,131 days,AD,1.0,Success,,,2.0,4.0,2.0,handler started moving around,,1.0,,,1,2,2,2,occasionally dog will walk ahead for a few seconds,,2,,,2.0,,,3,2.0,,,,1.0,2,No,No,,"dog lifted up onto table, was stressed",,No,Yes,Yes,Yes,Yes,No,No,Yes,Yes,Yes,Yes,No,,towel not folded over on 2nd time,,2,4,4,6,3,4.0,4.0,4.0,3,4.0,5,,,,5,sitting during but jumped once when kong was being given to handler,,Left,3.0,1.0,1.0,,2.0,handler has stepped back from dog,,3,0.0,,handler sat on chair an dog was in a down beside him,,1.0,3.0,2.0,2.0,1.0,1.0,2.0,1.0,1.0,2.0,2.0,No,,,,2.0,1.0,4.0,,4.0,,,3.0,3.0,2.0,1.0,1.0,No,,,3.0,,,,4.0,,,,,,,,,,,,,
Jojo,08-13-LJ,1,23/09/2019,A,LR,F,J,IGDB,Frances,2018-07-03,2019-08-28,2019-11-29,93 days,AD,1.0,Success,,,2.0,5.0,1.0,,,2.0,,,2,1,1,2,,,2,Position of dog during stand no conducive to effect response. ,,4.0,,,2,2.0,,Got a bit bored toward the end - hesitant to reassume down position. ,,3.0,3,No,No,,,,No,Yes,No,Yes,No,No,Yes,No,No,No,No,No,,,,3,3,3,3,3,3.0,2.0,3.0,3,3.0,6,,,,5,"Whining, jumping up, backing up",,Both,3.0,1.0,1.0,,2.0,,,3,0.0,,,,1.0,1.0,3.0,3.0,1.0,1.0,1.0,3.0,3.0,3.0,4.0,No,,,,1.0,1.0,3.0,,3.0,,,3.0,4.0,2.0,1.0,1.0,No,,,3.0,,,,4.0,,,,,,,,,,,,,
Jojo,08-13-LJ,2,14/11/2019,A,LR,F,J,IGDB,Frances,2018-07-03,2019-08-28,2019-11-29,93 days,AD,1.0,Success,,,2.0,5.0,1.0,Handler remarks on dog passing wind. Stress?,,1.0,,,2,1,1,2,,,2,Did well to start with but got bored at the end. ,,3.0,Handler sat. Was distracted by dog in the crate. ,,1,1.0,,Very activated by environment. ,,4.0,3,No,No,,,,Yes,No,No,No,No,No,Yes,No,No,No,No,No,,Too distracted by the environment to be worried about the tea towel.,,3,2,1,2,1,2.0,1.0,1.0,1,1.0,4,,So into handler didnt notice half the distractions,,5,"Loads of whining, jumping up at handler and then gets bored and starts exploring",,None,4.0,3.0,5.0,,2.0,Very playful - didnt want to give the kong back as it would mark end of the play session. High energy. ,,7,1.0,,Very playful and excited. Not really for the dog per se but just in general. ,,1.0,1.0,4.0,3.0,1.0,1.0,1.0,4.0,1.0,3.0,4.0,No,,,,1.0,1.0,5.0,,2.0,,,4.0,3.0,2.0,3.0,1.0,No,,,5.0,Jumps up at handler,,,3.0,,More interested in handler dropping the bucket than the bucket itself,,,,,,,,,,,
Harry,08-01-LH,1,18/09/2019,B,LRxGR,M,H,IGDB,Rose,2018-05-11,2019-08-21,2019-11-29,100 days,AD,1.0,Success,,,2.0,4.0,1.0,,,2.0,handler walked towards dog and he then went to the handler,,2,2,2,2,,,4,,,3.0,,,1,3.0,,"handler stayed crouched down with dog, ",,1.0,3,No,No,,,,No,Yes,Yes,Yes,Yes,No,No,Yes,No,Yes,Yes,No,,,,3,3,4,4,4,3.0,4.0,5.0,3,3.0,4,,,,4,"sat, went to nudge kong ",,Righ,4.0,1.0,1.0,,2.0,dog was on a loose lead,,5,2.0,,"didn't notice dog immediately as had gone off to have a sniff, once he notice he was gone after the dog",,1.0,4.0,3.0,2.0,1.0,1.0,1.0,1.0,1.0,2.0,2.0,No,,,,1.0,1.0,1.0,,2.0,,,2.0,4.0,2.0,1.0,1.0,No,,,3.0,,,,4.0,,,,,,,,,,,,,
Harry,08-01-LH,2,30/10/2019,B,LRxGR,M,H,IGDB,Rose,2018-05-11,2019-08-21,2019-11-29,100 days,AD,1.0,Success,,,1.0,5.0,1.0,,,1.0,,,2,2,2,3,,,2,,,4.0,handler asks dog twice very quickly together,,1,3.0,,,,1.0,3,No,No,,,,No,Yes,Yes,No,Yes,No,No,Yes,Yes,Yes,Yes,No,,tea towel not folded over,,6,5,4,5,3,4.0,3.0,3.0,2,3.0,5,,,,4,sits,,Left,3.0,3.0,2.0,,2.0,,,4,1.0,,,,1.0,4.0,3.0,1.0,1.0,1.0,1.0,1.0,1.0,1.0,1.0,No,,,,1.0,1.0,1.0,,0.0,,,5.0,1.0,1.0,1.0,1.0,No,,,0.0,"calmly responds when handler returns, but wouldn't go to handler",,,4.0,,,,,,,,,,,,,
Irrie,09-01-LI,1,02/10/2019,A,LRxGR,F,I,IGDB,Frances,2018-06-28,2019-09-04,2020-07-27,327 days,GD,2.0,Success,,,1.0,5.0,1.0,Whining - inaudible. Not sure if from this dog or from dog in crate (think the dog in crate). Frantic tail wagging.,,3.0,Was about to come back on first response but then continued exploring and didnt want to go back to the handler.,,3,1,1,3,Very scent distracted.,,2,Body shaking and edging forward. Seems quite activated - tail shaking. Panting and distracted. ,,1.0,Sat before she stood. Still very scent distracted and unsettled.,,1,1.0,,Fell off platform - did not count this as a failed attempt.,,4.0,2,No,No,,Needed help jumping up but I dont think this was due to any unwillingness. During check low tail carriage - even tucking slightly at times and a drop in rear posture at times too. ,,No,No,Yes,No,No,No,Yes,No,No,No,No,No,,Did look once on first attempt but wasnt too bothered about it. ,,6,4,3,2,3,3.0,2.0,3.0,3,4.0,6,,,,4,Excited and activated - regularly lift hind quarters off the floor and changing position. No terrible inappropriate behaviour shown and no jumping up. Didnt notice kong until shown by the handler as she was very distracted by the assessor that had passed with the teddy and/or food etc. ,,None,3.0,1.0,1.0,,2.0,,,5,1.0,,,,1.0,1.0,3.0,2.0,1.0,1.0,1.0,,,2.0,2.0,No,,"Difficult to tell with whining if it is coming from the dog in the crate, this dog or both dogs and as such difficult to ascertain whether the dog is attention seeking or not..",,1.0,2.0,3.0,,3.0,Reaction to petting ranged from a slight wagging of the tail to indifference as she did spend alot of time exploring and not wanting to go to the handler. ,,3.0,4.0,2.0,,1.0,No,,Goes onto 2nd video. Difficult to know which dog whining was coming from. ,1.0,More interested in assessor with bucket. ,,,4.0,,,,,,,,,,,,,
Irrie,09-01-LI,2,20/11/2019,A,LRxGR,F,I,IGDB,Frances,2018-06-28,2019-09-04,2020-07-27,327 days,GD,2.0,Success,,,2.0,5.0,1.0,High scent distraction. Body shaking.,,2.0,,,3,2,2,2,,,2,Quite distracted and unsettled.,,1.0,"Still quite distracted by environment - shifting position, and moving around and wanted to lie down at one point too",,1,1.0,,Very distracted by environment - quite activated and not wanting to listen to handler input even with loads of support. ,,4.0,3,No,No,,,,No,Yes,Yes,No,No,No,Yes,No,No,No,No,No,,Seems more inquisitive on first attempt but then loses interest and becomes indifferent thereafter.,,4,4,2,3,3,3.0,2.0,3.0,3,5.0,6,,,,4,briefly lifts hind quarters but good modulation,,Left,3.0,1.0,1.0,,2.0,,,7,2.0,,,,1.0,1.0,2.0,1.0,2.0,1.0,1.0,1.0,1.0,1.0,3.0,No,,Though she only exhibits a little bit of digging and sniffing (and pacing) from her body language I would say she isnt settle and is a little stressed.,,1.0,1.0,3.0,,1.0,,,3.0,3.0,3.0,1.0,1.0,No,,,1.0,,,,3.0,,More interested in the assessor as she was from the start of the test when he put the platform in for the stand. I dont think she was much phased by the bucket if at all,,,,,,,,,,,
Josie,09-03-LJ,1,02/10/2019,A,LR,F,J,IGDB,Diana,2018-07-03,2019-09-04,2020-08-17,348 days,GD,2.0,Success,,,2.0,5.0,1.0,,,1.0,,,2,1,1,2,,,1,,,1.0,Kept lying down during the sit. Handler struggled to keep dog in a sit.,,3,3.0,,Lay down without being asked to.,,4.0,3,No,No,,,,No,Yes,Yes,No,Yes,No,No,Yes,Yes,Yes,No,No,,,,1,3,4,1,3,2.0,2.0,1.0,1,1.0,6,,,,2,"At first seems partially interested but does turn attention away every now and then. Quickly loses interest, walks away/explores. Handler calls back and the dog gets more interested - higher activation and barking from excitement. ",,Righ,3.0,2.0,1.0,,2.0,Uses right paw at beginning but not for long. ,,4,1.0,,More explorative than interested,,1.0,1.0,2.0,5.0,1.0,2.0,4.0,3.0,4.0,3.0,4.0,No,,,,1.0,1.0,5.0,,3.0,,,5.0,1.0,3.0,1.0,5.0,No,,"Jumps out, over the gate.",3.0,,,,3.0,,slightly inquisitive at the bucket but no startle or real reaction,,,,,,,,,,,
Jira,08-11-LJ,1,23/09/2019,B,LR,F,J,IGDB,Frances,2018-07-03,2019-08-28,2020-02-03,159 days,GD,2.0,Success,,,1.0,5.0,1.0,,,2.0,,,1,1,1,3,,,2,last stand dog went into a sit and then was advised to do a sit,,3.0,,,3,3.0,,,,2.0,3,No,No,,,,No,Yes,Yes,Yes,Yes,Yes,No,Yes,Yes,No,No,No,,had used a treat for dog coming to handler,,4,5,5,6,3,4.0,4.0,6.0,4,5.0,7,,,,2,sat,,None,2.0,1.0,,,2.0,,,3,0.0,,,,1.0,1.0,2.0,4.0,1.0,1.0,3.0,2.0,4.0,3.0,2.0,No,,,,1.0,1.0,3.0,,3.0,,,5.0,1.0,2.0,2.0,4.0,No,,,1.0,dog walks away from handler,,,4.0,,,,,,,,,,,,,
Harmony,08-04-LH,1,30/10/2019,B,LRxGR,F,H,IGDB,Diana,2018-05-11,2019-08-21,2019-11-29,100 days,AD,1.0,Success,,,3.0,3.0,2.0,,,,dog beside handler,,1,1,1,3,,,3,,,2.0,,,2,3.0,,,,4.0,3,No,No,,,,No,Yes,No,Yes,No,No,No,Yes,Yes,Yes,Yes,No,,,,2,3,3,5,4,3.0,3.0,5.0,3,3.0,4,,,,5,jumps at handler twice,,None,3.0,1.0,1.0,,2.0,dog on lead,,4,1.0,,,,1.0,3.0,3.0,1.0,1.0,1.0,1.0,1.0,1.0,2.0,2.0,No,,,,1.0,1.0,3.0,,3.0,,,3.0,3.0,1.0,1.0,1.0,No,,,0.0,,,,4.0,,,,,,,,,,,,,
Jazzi,09-04-LJ,1,02/10/2019,A,LR,F,J,IGDB,"Rose, Diana",2018-07-03,2019-09-04,2020-07-27,327 days,GD,2.0,Success,,,2.0,5.0,1.0,,,1.0,,,2,1,1,2,,,1,Breaking with sits,,1.0,"Shifting weight, standing, moving position. I think very distracted by the dog in the crate who was barking very consistently throughout. ",,1,1.0,,,,4.0,3,No,No,,Slightly more reluctant when back paws are checked but co-operative the rest of the time. ,,Yes,No,No,No,No,No,Yes,No,No,No,No,No,,,,4,2,3,1,5,2.0,2.0,4.0,3,3.0,4,,,,5,"Edging forward, backing up and going side to side. Small jumps on all fours. Doesnt jump up at handler but still overly interested ",,Both,3.0,3.0,1.0,,2.0,,,2,3.0,,Explored for a long while before strolling up to dog and even then no real interest in the actual dog. When called back thought it was time to play and was jumping around ,,1.0,3.0,2.0,2.0,1.0,1.0,1.0,,1.0,1.0,2.0,No,,Does lie down toward the end,,1.0,1.0,4.0,,3.0,Not a proper isolation as the person filming was watching her with the camera. ,,5.0,1.0,2.0,3.0,1.0,No,,,3.0,,,,3.0,,,,,,,,,,,,,
Harmony,08-04-LH,2,30/10/2019,B,LRxGR,F,H,IGDB,Diana,2018-05-11,2019-08-21,2019-11-29,100 days,AD,1.0,Success,,,1.0,5.0,1.0,,,2.0,,,3,2,2,2,dog sniffed and walked,,4,,,4.0,,,1,3.0,,,,4.0,3,No,No,,,,No,Yes,Yes,Yes,Yes,No,No,Yes,Yes,Yes,Yes,No,,,,4,4,4,4,2,3.0,3.0,4.0,3,2.0,5,,,,5,"dog jump up on to get kong a few times, offers behaviours such as sits and downs  ",,None,3.0,1.0,1.0,,2.0,"handler steps away from the dog, but dog stays in the same place",,3,0.0,,handler told dog to wait,,1.0,4.0,2.0,1.0,1.0,1.0,1.0,1.0,1.0,1.0,1.0,No,,,,1.0,1.0,3.0,,3.0,,,3.0,2.0,2.0,1.0,1.0,No,,,4.0,,,,5.0,,,,,,,,,,,,,
Josie,09-03-LJ,2,20/11/2019,A,LR,F,J,IGDB,Diana,2018-07-03,2019-09-04,2020-08-17,348 days,GD,2.0,Success,,,1.0,5.0,1.0,,,1.0,,,1,1,1,2,Jumped on the examination table a few times but I think this is more because she felt it was what she was supposed to be doing.,,1,Perhaps unsure of what was wanted of her,,3.0,Broke stand with sit and handler continued on. Sit not requested.,,3,2.0,,"I think she was very distracted by the environment, the movement of the assessors and the dog in the crate barking. She appeared to settle well at one point and even dropped her side into a more settled position but this was short lived. ",,4.0,3,No,No,,Low tail  carriage ,,No,No,Yes,No,No,No,Yes,No,No,No,No,No,,First response - checked to see what was on back but then ignored it and carried on as per usual. Second response = no response,,1,2,2,4,1,3.0,2.0,3.0,2,3.0,4,,Car was not working/stable - scored on stable car.,,4,changing position - backing up etc. Lifting hindquarters very briefly. No truly inappropriate behaviour shown - good modulation,,None,3.0,2.0,1.0,,2.0,Dog kept on lead - I think she would have taken kong away from handler if she wasnt on lead. Has to follow handler with the kong when it is taken back for this reason too. ,,4,2.0,,Does come back on her own but then continues exploring ,,1.0,1.0,4.0,4.0,2.0,1.0,2.0,4.0,1.0,3.0,3.0,No,,,,1.0,1.0,4.0,,3.0,,,4.0,1.0,2.0,2.0,2.0,No,,,4.0,Rolls on back playfully,,,3.0,,Indifferent to noise - inquisitive of bucket,,,,,,,,,,,
Jazzi,09-04-LJ,2,20/11/2019,A,LR,F,J,IGDB,"Rose, Diana",2018-07-03,2019-09-04,2020-07-27,327 days,GD,2.0,Success,,,2.0,5.0,1.0,,,2.0,,,3,2,2,2,Very mild tension if any. At times the dog does walk out ahead of the handler but more consistently walks beside handler.  Quite scent distracted.,,4,Maintained even when slightly distracted,,4.0,,,4,4.0,,,,3.0,4,No,No,,,,No,Yes,No,Yes,No,No,Yes,No,No,No,No,No,,Second Response - Very briefly turned head at beginning but I think more direction based as she wanted to be looking at something past the gate,,3,4,3,1,3,4.0,2.0,4.0,3,3.0,6,,Car not working - scored on stationary car. ,,2,Does lift hind quarters briefly when handler began talking. Definitely very engaged with the kong but keeps sitting.,,Left,3.0,2.0,2.0,,2.0,Dog kept on lead - otherwise may have wondered off with the kong as she does pick the kong up and begin walking away. Also for this reason dog has to follow handler to take the kong back. ,,2,0.0,,No interest in the dog at all,,1.0,2.0,2.0,2.0,1.0,1.0,1.0,2.0,1.0,2.0,2.0,No,,,,1.0,1.0,3.0,,3.0,Tail wagging but more interested in exploring the environment,,5.0,1.0,2.0,4.0,1.0,No,,,3.0,Happy to see handler but loses interest quickly and explores,,,3.0,,,,,,,,,,,,,
Jira,08-11-LJ,2,06/11/2019,B,LR,F,J,IGDB,Frances,2018-07-03,2019-08-28,2020-02-03,159 days,GD,2.0,Success,,,,,,handler didn't stay in or near one spot and walked around continuously with the dog following.,,,"dog not called back, handler was speaking to another dog",,2,2,1,3,,,2,dog was off lead,,3.0,dog went into adown from sit without being asked ,,4,4.0,,,,4.0,3,No,No,,,,No,Yes,Yes,No,Yes,Yes,No,Yes,Yes,No,Yes,Yes,,"dog removes towel before moving, towel not folded over",,1,4,5,6,6,4.0,3.0,5.0,3,5.0,5,,,,2,dog sits,,None,3.0,3.0,1.0,,2.0,kong not placed on  ground but given to dog,,3,0.0,,handler had put dog into a sit as dog distraction dog had come out.,,1.0,3.0,3.0,2.0,1.0,1.0,3.0,2.0,1.0,2.0,2.0,No,,,,2.0,1.0,4.0,,4.0,,,5.0,1.0,1.0,2.0,4.0,No,,,3.0,,,,4.0,,,,,,,,,,,,,
Jane,10-04-LJ,1,24/10/2019,A,LR,F,J,IGDB,Graham,2018-07-03,2019-10-02,2020-02-14,135 days,AD,1.0,Success,,,2.0,5.0,1.0,Body shakes (body sensitivity?) ,,1.0,,,2,1,1,3,,,1,Constantly moving and changing position and breaking stand (sitting).,,3.0,Jumps at handler when assessor and handler begin laughing. Handler remarks on dog passing gas (stress?).,,3,4.0,,Handler remains in crouched position next to the dog. Lay down on second attempt but there might have been some confusion. ,,4.0,4,No,No,,,,Yes,No,No,No,No,No,Yes,No,No,No,No,No,,,,3,2,3,5,2,2.0,2.0,3.0,2,2.0,4,,,,2,Dog on lead. Anxious behaviour - lip smacking and moving head closer>> maintains sit nicely though,,Left,3.0,1.0,1.0,,3.0,Dog on lead so cannot take the kong anywhere but seemed to be very content with staying close and probably wouldnt have moved away anyway. A very short-lived favour of the left paw in the very beginning and then no use of any paws. ,,3,0.0,,Doesnt leave handlers side - definite mild interest though,,1.0,2.0,3.0,3.0,1.0,1.0,1.0,3.0,1.0,2.0,2.0,No,,,,1.0,1.0,2.0,,3.0,,,4.0,3.0,2.0,1.0,1.0,No,,,1.0,,,,4.0,,Very minor change in body language - extremely quick recovery,,,,,,,,,,,
Hayley,08-12-LH,1,23/09/2019,B,LRxGR,F,H,IGDB,Frances,2018-05-11,2019-08-28,2019-12-04,98 days,W,0.0,Fail,,,2.0,4.0,1.0,dog out of view of camera at times due to the angle of the camera,,1.0,,,3,4,4,1,,,1,,,2.0,,,3,2.0,,,,,3,No,No,,,,No,Yes,Yes,Yes,Yes,No,No,Yes,Yes,Yes,Yes,Yes,,,,4,3,3,4,3,3.0,3.0,4.0,3,3.0,4,,,,5,jumps at handler twice,,Left,3.0,1.0,1.0,,2.0,,,6,3.0,,"dog ran around, gave a few excitable bark. dog distraction took a while to get into crate",,4.0,,,,,,,,,,,,,,,1.0,1.0,3.0,,3.0,,,4.0,1.0,3.0,1.0,4.0,No,,,3.0,,,,4.0,,,,,,,,,,,,,
Jane,10-04-LJ,2,08/01/2020,A,LR,F,J,IGDB,Graham,2018-07-03,2019-10-02,2020-02-14,135 days,AD,1.0,Success,,,2.0,5.0,2.0,Handler follows dog around more than dog follows handler around.,,1.0,,,1,1,1,2,,,2,When handler starts speaking dog gets bored.,,4.0,,,4,4.0,,,,4.0,3,No,No,,Not a full body check carried out - only head and fore-paws,,Yes,No,No,No,No,No,Yes,No,No,No,No,No,,Sits on first response and doesnt seem phased however on second response she is hesitant to come too close to handler - even still she seems quite indifferent while cloth is on her back,,3,3,4,5,2,2.0,1.0,3.0,2,3.0,5,,Car wasnt working - scored on the stationary car.,,2,Handler holds the kong directly infront on the dogs face rather than at chest height. For this reason the dog actually behaved amazingly seeing as she only lifted her hind-quarters briefly once. Dog on lead,,Righ,4.0,1.0,1.0,,3.0,Dog on lead but I dont think she would have gone far off from the handler anyways as the handler occasionally drops the lead giving ample opportunity for the dog to move and she doesnt. Dog drops the kong of own accord when asked.,,0,0.0,,Delay in taking off the dogs lead which may have inhibited dogs natural initial reaction. Dog looks to handler for reward / praise / support. ,,2.0,2.0,3.0,1.0,1.0,1.0,1.0,,1.0,1.0,2.0,No,,Dont know if whine is from this dog or the one for distraction. Stayed standing the entire time - didnt move much but was looking at handler alot ,,1.0,1.0,3.0,,3.0,Slighly excited for a short time but quickly loses interest and explores.,,5.0,2.0,2.0,,1.0,No,,Not sure where the whining is coming from,3.0,Wagging tail - calm approach. Loses interest quickly,,,3.0,,,,,,,,,,,,,
Hayley,08-12-LH,2,06/11/2019,B,LRxGR,F,H,IGDB,Frances,2018-05-11,2019-08-28,2019-12-04,98 days,W,0.0,Fail,,,2.0,4.0,1.0,,,1.0,,,2,1,1,2,block lead used,,2,,,4.0,,,3,3.0,,,,3.0,3,No,No,,,,No,Yes,Yes,Yes,Yes,Yes,No,Yes,Yes,Yes,No,Yes,,,,2,4,4,3,3,3.0,4.0,3.0,2,2.0,5,,,,5,dog jumps twice at handler,,None,3.0,1.0,2.0,,2.0,handler steps away from dog but dog stays in the same spot,,6,2.0,,handler walked towards the crate before he called the dog,,2.0,3.0,2.0,2.0,1.0,1.0,1.0,2.0,1.0,2.0,2.0,No,,,,2.0,1.0,3.0,,4.0,,,5.0,1.0,2.0,4.0,2.0,No,,,4.0,,,,4.0,,,,,,,,,,,,,
Idris,10-14-LI,1,06/11/2019,B,LRxGR,M,I,IGDB,Mags,2018-06-28,2019-10-17,2020-02-12,118 days,W,0.0,Fail,,,2.0,3.0,2.0,,,1.0,,,1,1,1,2,,,2,,,2.0,,,4,3.0,,,,4.0,3,No,No,,,,No,Yes,Yes,Yes,Yes,No,No,Yes,Yes,No,No,No,,,,3,4,4,4,3,3.0,3.0,4.0,3,3.0,5,,,,4,sits and then goes down ,,Left,3.0,3.0,1.0,,2.0,"I couldn't see the paw lateralisation, but could hear assessor and handler day Left",,4,,,handler walked over to crate and dog came over to there,,1.0,2.0,4.0,1.0,1.0,2.0,1.0,1.0,1.0,2.0,2.0,No,,,,1.0,1.0,3.0,,3.0,,,5.0,1.0,4.0,1.0,1.0,No,,,4.0,dog had jumped out,,,4.0,,,,,,,,,,,,,
Idris,10-14-LI,2,09/01/2020,B,LRxGR,M,I,IGDB,Mags,2018-06-28,2019-10-17,2020-02-12,118 days,W,0.0,Fail,,,1.0,5.0,1.0,,,2.0,,,2,1,1,2,,,3,handler consistently petted the dog,,2.0,handler sat in front of the dog consistently petting and using treats,,4,3.0,,handler consistently petting the dog,,2.0,3,No,No,,,,No,Yes,Yes,No,No,No,No,Yes,Yes,No,No,No,,towel  [laced but not folded over,,4,4,4,5,2,3.0,3.0,3.0,2,3.0,5,,,,2,sat and then went into a down,,Left,3.0,1.0,1.0,,2.0,couldn't see gpaw lateralisation due to position of dog,,4,0.0,,,,1.0,3.0,3.0,1.0,1.0,1.0,1.0,1.0,1.0,2.0,2.0,No,,,,1.0,1.0,3.0,,3.0,,,3.0,3.0,2.0,1.0,1.0,No,,,3.0,jumped out initially,,,4.0,,,,,,,,,,,,,
July,10-03-LJ,1,30/10/2019,B,LR,F,J,IGDB,Graham,2018-07-03,2019-10-17,2020-06-08,235 days,AD,1.0,Success,,,1.0,5.0,1.0,,,2.0,,,3,1,1,3,,,1,,,4.0,,,2,3.0,,,,4.0,3,No,No,,,,No,Yes,Yes,Yes,No,No,No,No,No,No,No,No,,dog distracted by sniffing the ground,,4,4,1,5,2,3.0,2.0,3.0,3,5.0,5,,,,5,"sat, jumped up a few times",,Left,3.0,3.0,1.0,,2.0,,,4,2.0,,,,1.0,2.0,2.0,4.0,1.0,1.0,1.0,4.0,1.0,3.0,2.0,No,,,,1.0,1.0,3.0,,3.0,,,4.0,2.0,2.0,3.0,1.0,No,,,3.0,,,,4.0,,,,,,,,,,,,,
Kirby,10-15-LK,1,01/11/2019,A,LRxGR,M,K,IGDB,Mags,2018-08-02,2019-10-09,2020-07-20,285 days,AD,1.0,Success,,,2.0,5.0,2.0,scratching - body sensitivity? ,,1.0,,,1,1,1,2,Body shakes - body sensitivity?,,3,Handler body position a bit hunched in support. Quite scent distracted.,,2.0,Wanted to lay down and handler supported and maintained for a few seconds but he went on to lie down anyways Handler moved on. ,,4,4.0,,Not asked to lie down - but down maintained well after breaking sit - even resting head.,,4.0,4,No,No,,Needed help (hoisting) onto the table -- put fore-paws up and needing hindquarters hoisted. Bit I dont think this was any degree of a lack of willingness rather just wasnt expecting it and didnt run up sufficiently . Happy with the examination,,No,No,Yes,No,No,No,No,Yes,Yes,No,No,No,,Attempt 1 - did very quickly turn head to look at the towel but it was more an inquisitive look as he was not worried about it - didnt show any signs of concern. More interested in the handlers food reward. I wouldnt call this a lack of change in neutrality> more or less the same in the second attempt although he did seem a little more concerned and did try to move a bit more and looked a bit more too but it didnt phase him too much. Video was cut short so didnt the entirety of the second attempt,,3,3,3,5,2,2.0,2.0,5.0,2,3.0,5,,,,2,Sat and then lay down - no inappropriate behaviour at all. Stared very intently at the kong and showed a definite interest.,,None,3.0,3.0,1.0,,2.0,,,3,0.0,,Dog sits and lies down after a while - a definite look of interest but not enough to cause him to run after him or leave the handler,,1.0,5.0,2.0,1.0,1.0,1.0,1.0,1.0,1.0,1.0,1.0,No,,Sniffed for a few seconds but very calmly and then lay down. ,,1.0,1.0,3.0,,3.0,At first quite indifferent but comes when handler calls and wags tail a little,,5.0,1.0,2.0,2.0,3.0,No,,Lies down at gate after a bit of barking. Definite separation anxiety as opposed to any attention seeking. ,4.0,Though not what activated might look like in another dog - definite activation for this dog who is generally quite calm and indifferent ,,,4.0,,A very slight startle - looks at the assessor who dropped the can and suspicious of her afterward. But quick enough recovery.,,,,,,,,,,,
Kirby,10-15-LK,2,08/01/2020,A,LRxGR,M,K,IGDB,Mags,2018-08-02,2019-10-09,2020-07-20,285 days,AD,1.0,Success,,,3.0,5.0,1.0,After exploring a while goes back to handler on his own,,1.0,,,3,2,2,3,Loads of scratching (and this is why he occasionally drops behind the handler) - body sensitivity to the body piece.,,3,No platform used. He gets bored and lays down. Handler doesnt correct.,,1.0,Wanting to lay down all the time,,4,1.0,,Lay down without being asked and handler left him be ,,4.0,4,No,No,,Stood a bit skew on the table but happy enough,,Yes,No,Yes,No,No,No,Yes,No,No,No,No,No,,,,2,3,1,1,2,2.0,2.0,4.0,2,3.0,4,,Car stationary ,,4,"Dog kept on lead. Intense starting, backing up very slightly and a very quick slight and soft whine.",,None,3.0,1.0,1.0,,2.0,"Picked up kong, dropped it and handler took immediately. Dog on lead so has to follow handler but was calm.",,3,0.0,,Does stare at dog quite intently but doesnt break sit - stays at handler side,,2.0,4.0,2.0,1.0,1.0,1.0,1.0,1.0,1.0,1.0,1.0,No,,,,1.0,1.0,3.0,,3.0,,,4.0,2.0,3.0,,1.0,No,,I am not sure which dog the whining is coming from. After pacing a bit lies down infront of the gate.,3.0,,,,4.0,,Very minor - almost indifferent - Nothing more than a very slight suss at the can - quick recovery,,,,,,,,,,,
Kacie,10-31-LK,1,14/11/2019,A,LRxGR,F,K,IGDB,Graham,2018-08-02,2019-10-24,2020-06-08,228 days,AD,1.0,Success,,,1.0,5.0,1.0,,,1.0,,,3,1,1,2,Very activated/excited and very distracted by her environment,,1,Very scent distracted,,1.0,Very distracted by something in the background. Very restless,,4,2.0,,Lying posture - completely sprawled out with back legs straight behind. Still quite distracted but maintained well,,4.0,3,No,No,,"Ears pinned back, low tail carriage with frantic wagging, and couldnt wait to get off but didnt try to escape",,No,Yes,Yes,No,Yes,No,No,Yes,Yes,Yes,Yes,No,,Shakes body to get towel off on second attempt ,,3,4,1,3,4,5.0,3.0,2.0,4,4.0,6,,Very distracted by everything ,,5,"Very restless - jumps up, backs up, whines and when she thinks shes not getting her way she explores",,None,4.0,3.0,3.0,,2.0,,,3,0.0,,Definite interest and does break sit but doesnt move away from handler,,1.0,2.0,4.0,3.0,1.0,1.0,1.0,2.0,3.0,3.0,3.0,No,,,,1.0,1.0,4.0,,3.0,,,5.0,1.0,2.0,2.0,4.0,No,,,4.0,,,,3.0,,Quite obsessed with assessor holding the can - so her response was all related to that - no response to the noise of the can,,,,,,,,,,,
Kacie,10-31-LK,2,09/01/2020,A,LRxGR,F,K,IGDB,Graham,2018-08-02,2019-10-24,2020-06-08,228 days,AD,1.0,Success,,,1.0,5.0,1.0,Turned head to look at body piece,,1.0,,,3,2,2,2,No platform used.,,3,,,4.0,,,3,2.0,,Very distracted by all the barking going on in the background. ,,3.0,3,No,No,,,,No,Yes,Yes,No,Yes,No,Yes,No,Yes,No,No,No,,More interested in the assessor walking past to notice the towel on her back on the second attempt,,2,4,3,4,2,3.0,1.0,2.0,3,3.0,6,,,,4,Dog kept on lead. Some whining but brief and mild - tries to lie down and get attention in order to get the kong but wasnt over the top or inappropriate,,None,3.0,1.0,1.0,,2.0,,,4,0.0,,,,1.0,3.0,3.0,1.0,1.0,1.0,1.0,1.0,1.0,1.0,1.0,No,,,,1.0,1.0,4.0,,2.0,,,5.0,1.0,1.0,,1.0,No,,"Unsure of the whining and which dog it is coming from,.",4.0,,,,3.0,,More interested in the assessor holding the can and the can itself - not bothered by the noise,,,,,,,,,,,
