July,10-03-LJ,2,08/01/2020,B,LR,F,J,IGDB,Graham,2018-07-03,2019-10-17,2020-06-08,235 days,AD,1.0,Success,,,1.0,4.0,2.0,,,1.0,,,1,1,1,3,,,3,,,3.0,,,4,3.0,,went into a down from the sit without being asked ,,4.0,3,No,No,,,,No,Yes,Yes,Yes,No,No,Yes,Yes,No,No,No,No,,,,1,4,1,5,2,3.0,1.0,4.0,3,3.0,5,,car doesn't move,,5,dog jumps up,,None,3.0,1.0,1.0,,2.0,dog was on lead,,4,1.0,,,,2.0,3.0,2.0,3.0,1.0,2.0,1.0,2.0,1.0,2.0,2.0,No,,,,1.0,1.0,2.0,,2.0,,,3.0,3.0,2.0,2.0,1.0,No,,,2.0,,,,4.0,,,,,,,,,,,,,
Meeko,11-02-IM,1,18/12/2019,A,LR,M,M,IGDB,DSM,2018-08-25,2019-11-04,2020-05-29,207 days,W,0.0,Fail,,,3.0,5.0,2.0,,,2.0,,,3,1,1,3,High scent distraction,,2,Very distracted and restless,,2.0,handler crouches by dog and gives loads of support  - dog still quite distracted and breaks sit to scent,,3,2.0,,Handler crouched by dog still and gives alot of support. Breaks stand without being asked at the end,,2.0,4,No,No,,,,No,Yes,Yes,No,No,No,No,Yes,Yes,No,No,No,,,,4,3,2,4,4,4.0,2.0,3.0,2,2.0,6,,,,2,Moves position and stares intensely,,,,1.0,,,,Video in three parts and the interaction phase is not included. Final video skew and lots of motion,,2,2.0,,Video was very unstable so I couldnt watch his entire reaction and have based scoring on what I could see,,2.0,2.0,3.0,1.0,1.0,1.0,1.0,1.0,1.0,1.0,2.0,No,,Stayed standing the whole time so wouldnt say he is settled,,1.0,1.0,4.0,,3.0,,,5.0,1.0,2.0,1.0,1.0,No,,Dont know that dog was completely isoolated as the assessor holding the camera I dont think would have been completely out of sight. ,4.0,,,,3.0,,Hard to be sure from the angle of the camera,,,,,,,,,,,
Kelvin,10-13-LK,1,01/11/2019,B,LRxGR,M,K,IGDB,Rose,2018-08-02,2019-10-07,2020-06-22,259 days,GD,2.0,Success,,,2.0,4.0,1.0,,,,dog came back to handler before call back,,1,2,2,2,,,4,,,2.0,,,2,2.0,,handler used food and stayed down beside the dog,,4.0,3,No,No,,,,No,Yes,Yes,Yes,Yes,No,No,Yes,Yes,Yes,Yes,Yes,,,,6,5,4,3,6,4.0,4.0,,4,5.0,6,,didn't pass the dog food bowl the 2nd time,,4,"sits and breaks it to move nearer to handler, nudges handler ",,Both,3.0,1.0,1.0,,3.0,handler placed the kong away from them and the dog stayed in the same spot ,,5,1.0,,,,1.0,2.0,2.0,4.0,1.0,1.0,1.0,2.0,4.0,3.0,2.0,No,,,,1.0,1.0,3.0,,4.0,,,3.0,3.0,3.0,2.0,4.0,No,,,4.0,,,,4.0,,,,,,,,,,,,,
Kelvin,10-13-LK,2,09/01/2020,B,LRxGR,M,K,IGDB,Rose,2018-08-02,2019-10-07,2020-06-22,259 days,GD,2.0,Success,,,2.0,4.0,1.0,"monitor fell off collar, dog got out",,,no call back done,,1,2,2,2,,,3,,,2.0,,,4,3.0,,handler continuously pet dog and stays crouched beside the dog,,4.0,4,No,No,,,,No,Yes,Yes,Yes,Yes,Yes,No,Yes,Yes,Yes,Yes,Yes,,very excited,,6,5,4,6,2,4.0,3.0,3.0,3,5.0,6,,,,5,"dog jumps up at handler, sits, down, sits",,None,3.0,3.0,1.0,,2.0,,,5,1.0,,,,1.0,1.0,2.0,4.0,1.0,1.0,3.0,2.0,5.0,3.0,3.0,No,,,,1.0,1.0,4.0,,4.0,,,4.0,2.0,4.0,2.0,4.0,No,,,5.0,dog jumps up on handler,,,5.0,,,,,,,,,,,,,
Meeko,11-02-IM,2,16/01/2020,A,LR,M,M,IGDB,DSM,2018-08-25,2019-11-04,2020-05-29,207 days,W,0.0,Fail,,,3.0,5.0,1.0,,,1.0,,,3,1,1,3,Very distracted and needing support and encouragement to keep walking because of it,,1,"Scent distracted and not completely grasping the stand and wait command, hence quite distracted, wanting to move around and sit alot",,2.0,Scent distracted - looking for treats in handlers hands and breaking sit to sniff around.,,1,1.0,,Once again- scent distraction causing breaks. There is a possibility of body sensitivity here with not wanting to go down completely and/or breaking the down almost immediately and needing loads of handler support. ,,2.0,3,No,No,,,,No,Yes,Yes,No,No,No,No,No,Yes,No,No,No,,,,2,3,4,4,3,2.0,2.0,2.0,2,2.0,5,,,,2,Staring intently - does avert attention for a few seconds but reverts back to starting at kong. Good behaviour shown - no breaks in the sit or shifting weight or moving. ,,Both,3.0,1.0,2.0,,2.0,,,2,3.0,,While he does have a look at the dog and wags tail it is very short lived and not from the beginning - he is more interested in exploring and doesnt attempt to move toward the dog. It took several times before he went back to handler because of his high scent distraction,,1.0,4.0,3.0,1.0,1.0,1.0,1.0,1.0,1.0,1.0,1.0,No,,,,1.0,1.0,3.0,,2.0,,,2.0,4.0,1.0,1.0,1.0,No,,Even while at the gate and technically orientated there - he was still sniffing about. ,3.0,,,,4.0,,Sight change in posture - his head and ears slightly perk up - but very minor and almost immediate recovery,,,,,,,,,,,
Kain,11-11-IK,1,18/12/2019,A,LRxGR,M,K,IGDB,Mags,2018-08-02,2019-11-12,2020-07-15,246 days,AD,1.0,Success,,,2.0,4.0,1.0,Scratching - body sensitive?,,2.0,,,3,1,1,2,,,3,Whines and scratches and barks. Not the most stationary of stands and not quite happy to be doing it but not bad.,,3.0,A bit distracted by the background and air scenting. Handler remains crouched at his side,,3,1.0,,Handler remains crouched beside him. constant sniffing and very distracted by environment,,4.0,3,No,No,,Low tail carriage,,No,Yes,Yes,No,Yes,No,No,Yes,Yes,No,Yes,Yes,,have said yes to playing as handler took the towel from his mouth and he was slight activated when it was taken away,,6,5,5,6,6,4.0,4.0,6.0,4,5.0,6,,Quite obsessed with the teddy and food - especially teddy. Handler almost incapable of controlling him and nearly pulled off her feet. ,,5,Jumps up at handler in the beginner - does modulate but I dont think he would have maintained much longer than he did. ,,Left,4.0,1.0,2.0,,2.0,Video change over - new video not good quality - tilted 90 degrees and missed part of the session with the kong also not stable  ,,3,3.0,,Does look at dog but doesnt move toward the dog - only moves off to explore environment when dog is being put away. Cant see the entirety of this reaction due to the quality of the reaction so scored on what I could see,,3.0,2.0,2.0,1.0,1.0,1.0,1.0,1.0,1.0,1.0,2.0,No,,While he modulates well enough he def isnt settled ,,1.0,1.0,3.0,,3.0,Camera with handler/assessor so dog isnt completely isolated ,,5.0,1.0,2.0,1.0,1.0,No,,,4.0,,,,3.0,,,,,,,,,,,,,
Katie,11-21-IK,1,12/12/2019,B,LRxGR,F,K,IGDB,Mags,2018-08-02,2019-11-19,2020-06-08,202 days,AD,1.0,Success,,,1.0,5.0,1.0,,,1.0,,,2,2,2,1,,,2,,,2.0,,,2,2.0,,,,2.0,3,No,No,,,,No,Yes,Yes,Yes,Yes,No,No,No,Yes,Yes,No,No,,,,4,4,4,4,3,3.0,3.0,3.0,3,4.0,5,,,,5,"sits, jumps at handler, down, sits, down, sits",,None,3.0,3.0,2.0,,2.0,,,4,1.0,,,,1.0,3.0,2.0,2.0,1.0,1.0,1.0,2.0,1.0,2.0,2.0,No,,,,1.0,1.0,2.0,,2.0,,,2.0,4.0,3.0,2.0,1.0,No,,problem with equipment,3.0,,,,4.0,,,,,,,,,,,,,
Kaiser,11-24-IK,1,13/12/2019,A,LRxGR,M,K,IGDB,Graham,2018-08-02,2019-11-20,2020-07-20,243 days,GD,2.0,Success,,,2.0,5.0,2.0,Bit of whining . ,,1.0,,,3,2,2,1,Sometimes falls to heel but walks mostly ahead,,3,Quite distracted and activated. Licking handlers hand. ,,1.0,Whining barking and breaking - quite distracted and activated. Needed lots of handler support. ,,1,1.0,,"Whining, barking and breaking ",,4.0,4,No,No,,,,No,Yes,Yes,No,Yes,No,Yes,No,Yes,No,Yes,No,,,,6,4,4,4,1,2.0,3.0,4.0,4,5.0,6,,,,5,"Activated, lip smacking, whining, barking, attention seeking, jumping up at handler",,None,4.0,3.0,3.0,,3.0,,,6,1.0,,,,2.0,1.0,3.0,2.0,1.0,1.0,1.0,2.0,1.0,2.0,3.0,No,,,,1.0,1.0,3.0,,2.0,,,4.0,3.0,2.0,2.0,1.0,No,,,1.0,,,,4.0,,Quick recovery,,,,,,,,,,,
Katie,11-21-IK,2,28/01/2020,B,LRxGR,F,K,IGDB,Mags,2018-08-02,2019-11-19,2020-06-08,202 days,AD,1.0,Success,,,1.0,5.0,1.0,,,1.0,,,2,3,2,2,,,1,,,2.0,,,3,3.0,,handler stays crouched down beside dog,,4.0,1,No,No,,,,No,No,No,Yes,No,No,No,No,No,Yes,No,No,,,,4,4,3,6,3,3.0,3.0,6.0,4,5.0,6,,,,5,"jumps up for kong when being handed in, sits, downs, ",,Righ,3.0,3.0,2.0,,3.0,,,5,1.0,,handler walks towards dog and calls dog then,,1.0,3.0,2.0,3.0,1.0,2.0,1.0,3.0,1.0,2.0,2.0,No,,,,1.0,3.0,2.0,,2.0,,,2.0,4.0,4.0,1.0,1.0,No,,,3.0,,,,5.0,,,,,,,,,,,,,
Kain,11-11-IK,2,16/01/2020,A,LRxGR,M,K,IGDB,Mags,2018-08-02,2019-11-12,2020-07-15,246 days,AD,1.0,Success,,,2.0,5.0,1.0,,,1.0,,,3,2,2,1,,,2,Started off well but broke toward the end- distracted and bored,,2.0,Handler crouched by dogs side,,4,3.0,,Handler remains crouched,,4.0,3,No,No,,,,No,Yes,Yes,No,Yes,No,No,Yes,Yes,No,Yes,No,,,,6,2,2,3,3,3.0,2.0,4.0,4,5.0,4,,,,5,Jumping up at handler and staring very intently,,Both,3.0,1.0,1.0,,2.0,Dog on lead still so has to keep close to and follow the handler,,4,0.0,,,,1.0,2.0,2.0,3.0,1.0,1.0,1.0,3.0,1.0,2.0,3.0,No,,Sits on commands.,,1.0,1.0,3.0,,2.0,Quickly loses interest,,4.0,3.0,1.0,4.0,4.0,No,,Dog goes through gate,3.0,,,,6.0,,,,,,,,,,,,,
Meg,11-22-IM,1,12/12/2019,B,LR,F,M,IGDB,Mags,2018-08-25,2019-11-19,2020-01-31,73 days,W,0.0,Fail,,,2.0,4.0,2.0,problem with equipment,,1.0,,,1,1,1,4,,,4,,,3.0,,,1,,,dog did not go into a down after being asked by handler numerous times,,4.0,3,No,No,,,,No,Yes,Yes,No,No,No,No,Yes,Yes,Yes,No,No,,,,4,4,3,4,3,4.0,3.0,3.0,2,2.0,5,,,,2,sits,,None,3.0,3.0,2.0,,2.0,,,3,0.0,,,,2.0,2.0,3.0,1.0,1.0,1.0,1.0,1.0,1.0,2.0,2.0,No,,,,1.0,1.0,3.0,,3.0,,,5.0,1.0,1.0,1.0,1.0,No,,,3.0,,,,4.0,,,,,,,,,,,,,
Tosh,11-23-IT,1,12/12/2019,B,GR,M,T,GDBUK,Mags,2018-09-25,2019-11-19,2020-01-20,62 days,W,0.0,Fail,,,2.0,5.0,1.0,,,1.0,dog was near handler,,2,1,1,4,,,2,,,2.0,,,3,3.0,,,,3.0,3,No,No,,,,No,Yes,Yes,No,No,No,No,No,Yes,No,No,No,,,,3,3,3,3,3,3.0,3.0,3.0,1,1.0,4,,,,2,sits,,Left,3.0,1.0,2.0,,2.0,,,3,0.0,,,,2.0,2.0,3.0,1.0,1.0,1.0,1.0,1.0,1.0,2.0,2.0,No,,,,1.0,1.0,3.0,,3.0,,,2.0,4.0,1.0,1.0,1.0,No,,,3.0,,,,3.0,,,,,,,,,,,,,
Lexie,11-26-IL,1,12/12/2019,B,LR,F,L,IGDB,DSM,2018-08-17,2019-11-19,2020-07-20,244 days,AD,1.0,Success,,,1.0,5.0,1.0,,,1.0,,,1,1,2,4,,,3,,,3.0,handler sat on chair,,4,4.0,,,,3.0,2,No,Yes,,,,No,Yes,Yes,Yes,Yes,No,No,No,Yes,No,No,No,,,,4,5,3,1,1,4.0,1.0,1.0,2,5.0,7,,,,4,sits,,None,3.0,1.0,4.0,,2.0,handler had to distract dog with treats as dog moved away with kong when handler tried to get kong back,,3,0.0,,,,1.0,4.0,2.0,1.0,1.0,1.0,1.0,1.0,1.0,1.0,2.0,No,,,,1.0,1.0,4.0,,5.0,,,2.0,4.0,1.0,1.0,1.0,No,,,3.0,,,,4.0,,,,,,,,,,,,,
Kaiser,11-24-IK,2,28/01/2020,A,LRxGR,M,K,IGDB,Graham,2018-08-02,2019-11-20,2020-07-20,243 days,GD,2.0,Success,,,2.0,5.0,1.0,,,2.0,,,2,2,2,1,,,2,Counted the first few responses in my scorem- the ones before handler moved on to sit (and came back to stand). Sat at the end without being asked. ,,4.0,Barking and whining (but I dont know whether the whining is coming from him or the dog in the crate). Was supposed to do a stand but decided to do a sit first. ,,4,3.0,,Settles very nicely toward the end of the exercise,,4.0,4,No,No,,,,No,Yes,Yes,No,Yes,No,No,Yes,Yes,No,Yes,No,,,,2,2,3,5,5,2.0,2.0,4.0,4,4.0,4,,,,4,"Whining, intense stare but maintains sit",,Both,3.0,3.0,1.0,,2.0,,,5,2.0,,,,1.0,2.0,3.0,1.0,1.0,1.0,1.0,,1.0,2.0,2.0,No,,,,1.0,3.0,3.0,,3.0,Dog on lead. ,,4.0,2.0,3.0,,1.0,No,,,3.0,,,,4.0,,Minor suss - quick recovery,,,,,,,,,,,
Jessie,11-25-IJ,1,13/12/2019,A,LR,F,J,IGDB,Graham,2018-07-03,2019-11-20,2020-07-31,254 days,GD,2.0,Success,,,3.0,5.0,2.0,,,1.0,,,1,1,1,2,,,1,,,1.0,Sat without being asked (break from stand) handler moves on. ,,2,1.0,,,,4.0,3,No,No,,,,No,Yes,Yes,No,No,No,Yes,No,No,No,No,No,,,,1,3,2,4,1,2.0,2.0,2.0,2,3.0,3,,,,2,Lay down after sitting staring for a while,,None,3.0,3.0,1.0,,2.0,"Is left on lead - but still manages to take the kong across the room albeit that the handler follows - however, had there been no lead he definitely would have taken the kong away, also he had to follow back being on lead",,5,0.0,,,,1.0,1.0,4.0,2.0,1.0,1.0,1.0,2.0,1.0,2.0,2.0,No,,,,1.0,1.0,2.0,,3.0,,,4.0,2.0,3.0,3.0,1.0,No,,,4.0,,,,3.0,,,,,,,,,,,,,
Jessie,11-25-IJ,2,28/01/2020,A,LR,F,J,IGDB,Graham,2018-07-03,2019-11-20,2020-07-31,254 days,GD,2.0,Success,,,2.0,5.0,1.0,,,1.0,,,2,1,1,2,,,2,Lots of moving around,,1.0,,,3,2.0,,Handler remains crouched.,,4.0,3,No,No,,,,Yes,No,No,No,No,No,Yes,No,No,No,No,No,,,,3,2,3,5,1,2.0,2.0,4.0,2,3.0,4,,,,2,Video cut short but from what was recorded - she was interested and looking but no breaking the sit and no inappropriate behaviour at all.,,Left,2.0,1.0,1.0,,2.0,,,4,0.0,,Loses interest quickly and goes back to handler,,1.0,1.0,4.0,4.0,2.0,3.0,3.0,2.0,1.0,2.0,3.0,No,,,,1.0,1.0,3.0,,3.0,,,5.0,1.0,2.0,2.0,1.0,No,,,3.0,,,,4.0,,Very minor - almost indifferent,,,,,,,,,,,
Zander,11-28-IZ,1,13/12/2019,A,LR,M,Z,Cesecah,Rose,2018-10-19,2019-11-18,2020-03-10,113 days,W,0.0,Fail,,,1.0,5.0,1.0,Called back to fix the device,,1.0,,,1,1,1,2,,,4,,,1.0,Distracted by dog in the crate. ,,1,1.0,,Distracted by dog in the crate. ,,3.0,4,No,No,,,,Yes,No,No,No,No,No,Yes,No,No,No,No,No,,,,1,3,2,3,3,2.0,2.0,3.0,2,2.0,6,,,,5,"Jumping up, sitting up on hind quarts (lifts forepaws off the floor), lying down, shifting and restless",,,3.0,1.0,1.0,,3.0,Cant decipher lateralisation because of camera angle.,,2,1.0,,"Does look over at dog a few times but doesnt go toward at all, does explore but could be displacement with the way he is circling and frantically sniffing",,1.0,2.0,4.0,1.0,1.0,2.0,1.0,1.0,1.0,1.0,2.0,No,,,,1.0,1.0,2.0,,3.0,goes back when called but more interested in exploring the environment,,4.0,3.0,2.0,3.0,1.0,No,,,5.0,very excited and jumped up at handler,,,4.0,,A slight inquisitive look but quick recovery ,,,,,,,,,,,
Zander,11-28-IZ,2,28/01/2020,A,LR,M,Z,Cesecah,Rose,2018-10-19,2019-11-18,2020-03-10,113 days,W,0.0,Fail,,,2.0,5.0,1.0,,,1.0,,,2,1,1,2,,,4,,,2.0,Getting bored and wants to lie down,,2,3.0,,when finally in down he settles down nicely - didnt like lying on the platform as much,,4.0,3,No,No,,,,No,Yes,Yes,No,No,No,No,Yes,Yes,No,No,No,,,,3,3,2,4,2,2.0,1.0,3.0,3,3.0,6,,,,4,Slight whine and quite restless and anxious to get the kong,,None,4.0,2.0,1.0,,2.0,,,5,0.0,,,,1.0,1.0,1.0,2.0,1.0,1.0,1.0,2.0,1.0,2.0,2.0,No,,,,1.0,1.0,3.0,,2.0,,,3.0,4.0,1.0,2.0,1.0,No,,,3.0,,,,3.0,,,,,,,,,,,,,
Kali,12-01-LK,1,09/01/2020,A,LRxGR,F,K,IGDB,Graham,2018-08-02,2019-12-11,2020-06-29,201 days,GD,2.0,Success,,,,5.0,,Handler didnt stay with dog during the familiarisation process,,1.0,,,3,2,2,2,Sometimes walks ahead of handler,,4,No platform used.,,1.0,,,4,2.0,,Whining,,4.0,2,No,No,,Happy to be checked and not necessarily over-aware of the body handling but she is very activated and excited and wants to jump off (tail wagging),,No,Yes,Yes,Yes,No,No,Yes,No,No,No,No,No,,Does jump up and hence towel falls off in the second attempt but I dont think this was an attempt to remove the towel but rather a co-incidence,,4,4,4,1,1,5.0,2.0,1.0,3,4.0,6,,,,4,"Would select n/a if it was here as the kong wasnt really introduced in the normal way, however, the initial reaction was high interest. ",,Left,3.0,3.0,1.0,,2.0,drops kong for handler at her feet when called back,,4,1.0,,,,1.0,1.0,2.0,3.0,1.0,1.0,1.0,3.0,1.0,2.0,2.0,No,,,,1.0,1.0,3.0,,2.0,,,4.0,2.0,3.0,3.0,2.0,No,,,5.0,Jumps up at handler,,,3.0,,,,,,,,,,,,,
Kali,12-01-LK,2,19/02/2020,A,LRxGR,F,K,IGDB,Graham,2018-08-02,2019-12-11,2020-06-29,201 days,GD,2.0,Success,,,1.0,5.0,1.0,Whining - inaudible but I think it comes from the dog in the crate,,1.0,,,3,3,2,1,Quite distracted by dog whining in the crate,,3,,,3.0,,,3,3.0,,,,4.0,4,No,No,,,,No,Yes,Yes,No,Yes,No,Yes,No,No,No,No,No,,,,2,3,1,5,3,2.0,2.0,4.0,3,4.0,6,,,,4,Intent stare and trying to do obedience to get handler to give kong,,Left,3.0,3.0,1.0,,2.0,,,4,1.0,,Only moves toward the dog at the very end - but for the most of the time she sits at handlers side unsure of what to do,,1.0,2.0,1.0,1.0,1.0,1.0,1.0,1.0,1.0,1.0,2.0,No,,"Although not portraying any real signs of stress like whining, she stays stood the entire time and not settled.",,1.0,1.0,4.0,,2.0,,,4.0,3.0,3.0,2.0,1.0,Yes,,I would say the urination is due to stress,3.0,,,,4.0,,I wouldnt say it was strong as I dont believe she was running to the source of the noise rather the new object to look at and sniff,,,,,,,,,,,
Meg,11-22-IM,2,30/01/2020,B,LR,F,M,IGDB,Mags,2018-08-25,2019-11-19,2020-01-31,73 days,W,0.0,Fail,,,1.0,5.0,1.0,,,1.0,,,1,2,2,2,,,3,,,4.0,,,3,4.0,,,,4.0,3,No,No,,,,No,Yes,Yes,No,No,No,No,No,Yes,No,No,No,,,,4,5,4,5,1,4.0,3.0,2.0,3,5.0,6,,,,2,sits,,Righ,3.0,1.0,2.0,,2.0,,,3,0.0,,,,1.0,2.0,3.0,1.0,1.0,2.0,1.0,1.0,1.0,2.0,2.0,No,,,,1.0,1.0,3.0,,3.0,,,5.0,1.0,1.0,1.0,1.0,No,,,3.0,,,,4.0,,,,,,,,,,,,,
Lexie,11-26-IL,2,30/01/2020,B,LR,F,L,IGDB,DSM,2018-08-17,2019-11-19,2020-07-20,244 days,AD,1.0,Success,,,1.0,5.0,1.0,,,1.0,,,1,1,1,3,,,4,,,4.0,,,3,3.0,,,,4.0,3,No,Yes,,,,No,Yes,Yes,Yes,No,No,No,Yes,Yes,Yes,No,No,,,,3,4,3,1,2,4.0,2.0,1.0,2,3.0,5,,,,2,sits,,None,3.0,3.0,2.0,,2.0,,,3,0.0,,,,1.0,3.0,3.0,3.0,1.0,1.0,2.0,2.0,1.0,2.0,2.0,No,,,,1.0,1.0,4.0,,4.0,,,2.0,4.0,3.0,1.0,1.0,No,,,4.0,,,,4.0,,,,,,,,,,,,,
Tosh,11-23-IT,2,28/01/2020,B,GR,M,T,GDBUK,Mags,2018-09-25,2019-11-19,2020-01-20,62 days,W,0.0,Fail,,,1.0,5.0,1.0,,,1.0,,,2,1,1,2,,,3,,,4.0,,,4,4.0,,,,4.0,3,No,No,,,,No,Yes,Yes,Yes,No,No,No,Yes,Yes,No,No,No,,,,4,4,3,4,1,3.0,2.0,3.0,2,2.0,5,,,,2,sits,,Left,3.0,1.0,1.0,,2.0,,,4,2.0,,dog was sitting with his back towards the other dog,,1.0,3.0,2.0,1.0,1.0,1.0,1.0,1.0,1.0,2.0,2.0,No,,,,1.0,2.0,3.0,,3.0,,,1.0,5.0,1.0,1.0,1.0,No,,,3.0,,,,3.0,,,,,,,,,,,,,
Illana,11-27-II,1,18/12/2019,B,LRxGR,F,I,IGDB,DSM,2018-06-28,2019-11-18,2020-07-15,240 days,AD,1.0,Success,,,1.0,5.0,1.0,,,1.0,,,3,2,2,2,,,3,,,1.0,,,1,1.0,,,,4.0,2,,,,couldn't see if she licks or mouths as handler was in front of camera,,No,Yes,Yes,Yes,Yes,No,No,Yes,Yes,Yes,No,No,,,,6,5,4,6,6,,,5.0,3,5.0,5,,,,2,sits,,,3.0,1.0,1.0,,2.0,"dog has back to camera, can't see paws",,4,2.0,,dog was initially distracted by treat pouch and didn't realise distraction dog was there,,1.0,3.0,3.0,1.0,1.0,1.0,3.0,1.0,1.0,2.0,2.0,No,,,,2.0,1.0,2.0,,2.0,,,3.0,3.0,2.0,1.0,1.0,No,,,2.0,,,,3.0,,,,,,,,,,,,,
Illana,11-27-II,2,30/01/2020,B,LRxGR,F,I,IGDB,DSM,2018-06-28,2019-11-18,2020-07-15,240 days,AD,1.0,Success,,,2.0,4.0,1.0,,,1.0,,,2,3,2,2,,,3,,,1.0,,,1,1.0,,,,4.0,3,No,No,,,,No,Yes,Yes,No,No,No,No,Yes,Yes,Yes,No,No,,,,4,4,3,4,4,4.0,1.0,3.0,3,4.0,5,,,,2,sits,,Left,3.0,3.0,2.0,,2.0,,,3,1.0,,,,1.0,2.0,3.0,1.0,1.0,2.0,1.0,1.0,1.0,2.0,2.0,No,,,,1.0,1.0,1.0,,1.0,,,2.0,4.0,2.0,1.0,1.0,No,,,3.0,,,,4.0,,,,,,,,,,,,,
Zita,10-41-LZ,1,30/10/2020,B,LRxGR,F,Z,GDBUK,Alison,2019-04-29,2020-10-05,2021-05-21,228 days,GD,2.0,Success,14:31:17,00:09,1.0,5.0,1.0,,01:12,1.0,,01:22,2,3,2,2,,02:52,2,,03:39,3.0,video was stopped due to monitor moving down her side,00:03,1,1.0,01:33,handler stayed kneeling down and used treats,01:43,,3,Yes,Yes,02:05,handler didn't put dog on table,02:18,No,Yes,Yes,Yes,Yes,No,No,Yes,Yes,Yes,No,No,02:46,,03:19,4,4,4,5,3,3.0,3.0,5.0,4,5.0,6,04:09,,04:37,4,"mainly sit and intermittently whines, moves and sits again",05:25,Righ,3.0,1.0,1.0,05:41,2.0,,06:07,4,1.0,06:26,,07:26,3.0,2.0,2.0,4.0,1.0,1.0,1.0,4.0,3.0,3.0,3.0,No,08:38,,08:40,2.0,1.0,5.0,09:02,5.0,"jumps up. grabs lead, ",09:20,3.0,2.0,3.0,3.0,1.0,No,10:34,,4.0,,10:44,11:13,4.0,11:27,,4,01:17;01:34;03:10;02:10;02:57;06:54;09:12;09:29,0,04:40;04:42;04:45;04:52;05:01;05:08;07:44-07:54;7:58;07:59;08:08;09:27;09:36;09:41;10:00;10:02;10:05;10:11;10:17;10:21,07:55;08:04;08:10;08:12;08:14;08:18;08:20;,08:21-:08:26,0,0,0,,01:14;02:28;02:32;08:07;11:01
Tim,10-42-LT,1,30/10/2020,B,LR,M,T,GDBUK,Alison,2019-04-20,2020-10-05,2021-05-21,228 days,GD,2.0,Success,13:29:04,00:03,2.0,4.0,1.0,urinated against pillar,01:11,2.0,,01:23,2,3,2,2,,02:35,1,,03:54,3.0,,05:00,2,2.0,06:05,handler stayed kneeling beside the dog,06:17,4.0,3,No,No,,06:32,06:48,No,Yes,Yes,Yes,No,No,No,Yes,Yes,Yes,No,No,07:31,,08:06,2,2,2,4,1,4.0,3.0,2.0,3,3.0,6,08:53,,09:43,4,stays sitting,10:05,None,3.0,1.0,1.0,10:24,2.0,,10:41,5,1.0,11:10,,11:31,2.0,4.0,2.0,1.0,1.0,1.0,1.0,1.0,1.0,1.0,2.0,No,12:44,,12:51,1.0,1.0,3.0,13:10,3.0,,13:29,5.0,1.0,1.0,2.0,1.0,No,14:40,,3.0,,14:54,15:26,4.0,15:38,,0,01:37;08;42,0,13:46-13:49,0,0,0,0,0,04:30;09:25;09:38,00:07;01:52;12:04
Rebecca,10-43-LR,1,30/10/2020,B,LRxGR,F,R,GDBUK,Alison,2019-04-15,2020-10-05,2021-05-21,228 days,GD,2.0,Success,13:57:22,00:04,2.0,4.0,1.0,,00:16,1.0,,01:24,2,2,2,2,,02:52,1,,03:59,,dog moved from a sit to a stand and was left standing ,05:12,2,2.0,06:20,handler stayed kneeling beside the dog,06:30,4.0,2,No,Yes,06:50,,07:07,No,Yes,Yes,Yes,Yes,Yes,No,Yes,Yes,Yes,Yes,Yes,07:32,,08:06,4,4,3,4,4,4.0,3.0,4.0,3,2.0,6,08:55,,09:16,2,"sits, moves slightly nearer the handler, whines and sits again",10:02,Righ,3.0,1.0,1.0,10:17,2.0,,10:36,3,1.0,10:55,,11:25,3.0,1.0,2.0,1.0,1.0,1.0,1.0,1.0,1.0,3.0,4.0,No,12:33,dog wasn't happy with the noise from walking in the crate,12:37,2.0,1.0,4.0,12:59,1.0,,13:23,3.0,3.0,1.0,2.0,1.0,No,14:31,,2.0,,14:45,15:10,4.0,15:19,,0,07:06;12:45,0,04:34;09:30;14:17,0,0,0,0,0,04:32;04:59,01:23;04:52;04:57;05:20;05:37;09:10;12:40;13:43;15:01
Eddie,10-45-LE,1,30/10/2020,B,LR,M,E,GDBUK,Alison,2019-03-18,2020-10-05,2021-06-11,249 days,GD,2.0,Success,12:58:19,00:20,5.0,1.0,5.0,stood beside the handler,,,dog was beside the handler,01:40,2,2,2,3,,02:54,4,,03:55,1.0,,05:04,3,2.0,06:17,handler stayed kneeling beside the dog,06:27,4.0,3,No,No,06:42,,06:57,No,Yes,Yes,No,No,No,No,Yes,Yes,No,No,No,07:47,dog didn't move from being near the handler,08:25,4,4,4,4,3,4.0,3.0,2.0,2,2.0,6,09:39,,10:15,2,"stood beside the handler, occasionally looking around",11:11,None,3.0,1.0,1.0,11:25,2.0,,11:54,3,0.0,12:15,,12:45,2.0,2.0,2.0,1.0,1.0,1.0,1.0,1.0,1.0,2.0,2.0,No,12:46,,13:52,1.0,1.0,3.0,14:13,3.0,,14:42,5.0,1.0,1.0,1.0,1.0,No,16:05,,3.0,handler put dog on lead very soon after coming in,16:15,16:45,4.0,16:51,,0,0,0,0,0,0,0,0,0,04:30,04:15;04:20;04:28;04:25;04:31
Zita,10-41-LZ,2,17/12/2020,B,LRxGR,F,Z,GDBUK,Alison,2019-04-29,2020-10-05,2021-05-21,228 days,GD,2.0,Success,12:41:53,00:04,2.0,4.0,1.0,,01:21,1.0,handler walks towards the dog as she calls her and dog comes to meet handler,01:31,2,3,2,2,,02:22,2,,03:24,4.0,,04:24,1,1.0,05:37,,05:46,4.0,2,No,Yes,06:13,,00:00,No,Yes,Yes,Yes,Yes,Yes,No,Yes,Yes,Yes,Yes,No,00:32,video recorder had stopped,1:01,4,4,4,4,4,4.0,4.0,4.0,4,4.0,5,01:38,,02:00,4,"sits, moves, sits ","sits, moves sits again",Righ,3.0,2.0,2.0,03:00,2.0,,04:27,5,1.0,04:48,,,3.0,1.0,2.0,5.0,1.0,1.0,1.0,5.0,1.0,3.0,3.0,No,06:10,,,,,,,,no petting done ,06:40,4.0,1.0,2.0,2.0,1.0,No,07:43,,4.0,handler put dog on lead and started walking,07:49,08:17,4.0,08:24,,4,"01:01,03:22;06:23;06:51;08:22",0,"00:10;05:11-05:23;05:30-05:33;05:36-05:38;05:40-41;05:43-05:44;05:46-05:52;05:55-06:00,06:01-0",0,0,0,08:21,0,0,0:44;02:03;03:12;00:49;02:09;03:09;03:12;08:15
Tim,10-42-LT,2,17/12/2020,B,LR,M,T,GDBUK,Alison,2019-04-20,2020-10-05,2021-05-21,228 days,GD,2.0,Success,12:18:10,00:05,5.0,1.0,5.0,,01:08,,no need for a call back as dog sat beside handler,01:08,1,2,2,3,,02:14,1,,03:21,4.0,,04:21,4,3.0,05:31,,05:42,4.0,3,No,No,06:16,,06:35,Yes,Yes,Yes,Yes,Yes,No,Yes,No,No,Yes,No,No,07:00,,07:37,4,4,3,3,3,3.0,2.0,3.0,2,2.0,7,08:18,,08:35,4,"sits, moves sits goes into a down",09:14,None,3.0,2.0,2.0,09:37,2.0,dog was on lead,10:10,3,0.0,10:33,,10:47,1.0,4.0,2.0,1.0,1.0,1.0,1.0,1.0,1.0,1.0,1.0,No,11:56,,12:01,1.0,1.0,3.0,12:25,2.0,,12:43,5.0,1.0,1.0,2.0,1.0,No,13:52,,3.0,,14:07,14:35,4.0,14:40,,2,10:01,0,13:20-13:24,02:47,0,0,0,0,00:49;03:33;09:07,01:20;01:25;01:44;02:16;02:19;02:41;02:54;08:44;08:50;10:05
Rebecca,10-43-LR,2,17/10/2020,B,LRxGR,F,R,GDBUK,Alison,2019-04-15,2020-10-05,2021-05-21,228 days,GD,2.0,Success,13:32:35,00:05,4.0,5.0,1.0,,01:06,1.0,,01:11,1,2,2,3,,02:11,2,,03:13,2.0,,04:19,3,3.0,05:20,,05:31,4.0,2,No,No,05:55,,06:12,No,Yes,Yes,Yes,Yes,No,No,Yes,Yes,No,No,No,06:31,,07:04,4,4,2,3,3,4.0,2.0,2.0,3,2.0,6,07:421,,08:06,4,sat would look away occasionally,08:52,None,3.0,1.0,1.0,09:17,2.0,,09:46,3,0.0,10:03,,10:21,3.0,1.0,1.0,1.0,1.0,1.0,1.0,1.0,1.0,3.0,3.0,No,11:38,,11:47,1.0,1.0,3.0,11:48,2.0,,12:16,4.0,3.0,1.0,1.0,1.0,No,13:33,,2.0,,13:49,14:,4.0,14:32,,0,06:07;07:32,0,0,0,0,0,0,0,0,01:38;01:44;06:37;08:11;09:27;09:31;09:41;10:09;12:24;13:38
Eddie,10-45-LE,2,17/10/2020,B,LR,M,E,GDBUK,Alison,2019-03-18,2020-10-05,2021-06-11,249 days,GD,2.0,Success,13:10:32,00:05,5.0,1.0,5.0,,,,,01:07,1,1,1,4,,02:08,4,,03:14,3.0,,04:18,2,3.0,05:25,,05:36,3.0,3,No,No,06:04,,06:22,No,Yes,No,No,No,No,No,No,Yes,No,No,No,06:48,,07:19,3,4,4,2,3,4.0,3.0,2.0,2,2.0,6,08:04,,08:27,2,remains sitting,09:06,None,3.0,1.0,1.0,09:28,2.0,,09:56,3,0.0,10:09,,10:25,1.0,2.0,4.0,1.0,1.0,1.0,1.0,1.0,1.0,2.0,2.0,No,11:33,,11:35,1.0,1.0,3.0,11:59,1.0,stays standing beside handler,12:18,4.0,2.0,1.0,1.0,1.0,No,13:39,,3.0,,13:48,14:19,4.0,14:24,,0,0,0,11:22,0,0,0,0,0,0,01:40;02:56;07:33;08:19
Minnie,12-02-LM,1,09/01/2020,B,LR,F,M,IGDB,Rose,2018-08-25,2019-12-09,2020-07-21,225 days,GD,2.0,Success,13:41:24,00:18,,5.0,1.0,handler stayed outside,,,dog came straight to handler once handler went in ,01:46,1,3,2,2,,02:53,4,,03:38,3.0,,04:43,3,1.0,05:30,handler stayed kneeling beside dog,05:38,4.0,2,No,No,06:05,,06:22,No,Yes,Yes,Yes,Yes,Yes,No,Yes,Yes,Yes,Yes,No,06:49,,07:27,6,4,3,5,2,2.0,2.0,2.0,3,5.0,7,08:11,,08:31,2,stays sitting,08:58,Righ,3.0,2.0,4.0,10:00,2.0,,10:25,3,0.0,10:44,,11:03,2.0,1.0,2.0,3.0,1.0,1.0,2.0,2.0,1.0,3.0,3.0,No,12:14,,12:17,1.0,1.0,2.0,12:21,2.0,,12:34,4.0,2.0,2.0,2.0,1.0,No,14:23,,4.0,,14:34,14:54,4.0,15:00,,1,01:12;06:18;12:22,0,11:17-11:20;11:26-11:28;11:50-11:53;12:05-12:08;13:22,0,0,0,0,0,0,01:10;01:59;02:15;05:54;08:01;08:06
Milo,12-03-LM,1,09/01/2020,B,LR,M,M,IGDB,Rose,2018-08-25,2019-12-09,2020-08-24,259 days,AD,1.0,Success,14:12:58,00:04,,5.0,1.0,handler stayed outside,,,dog came to handler when handler entered,01:25,1,1,1,3,,02:25,2,,03:29,1.0,,04:49,3,2.0,05:39,handler stayed kneeling beside the dog,05:49,3.0,3,No,No,06:10,,06:32,Yes,Yes,No,No,No,No,Yes,No,No,Yes,Yes,No,07:13,,08:04,4,3,4,4,1,3.0,2.0,2.0,2,2.0,5,08:44,,08:53,5,sits and then jumps up slightly,09:27,Both,3.0,,2.0,10:04,2.0,handler moves away,10:24,5,,10:57,dog shakes and unit needs to be put back on the neck,11:27,2.0,4.0,2.0,1.0,1.0,2.0,1.0,1.0,1.0,2.0,2.0,No,12:37,,12:38,1.0,1.0,3.0,12:48,3.0,,12:57,4.0,2.0,2.0,2.0,1.0,No,14:08,,3.0,,14:18,14:37,4.0,14:49,,1,00:40;10:57;,0,13:14,0,0,0,0,0,0,01:04;01:36;10:41;10:47
